"","X.6","X.5","X.4","X.3","X.2","X.1","X","tag","table","OBJECTID","quadrat","StemTag","lx","ly","dbh_previous","hom","codes_previous","status_previous","status_2022","comment_2022","mortality","census_status","dbh_current","status_current","codes_current","code_choices","notes_current","DBH.check","living_status","crown_position","crown_intact","crown_living","fad","fad_choices","liana_load","lean_angle","wounded_main_stem","rotting_trunk","canker_swelling_deformity","dead_with_resprout","crown_check","GlobalID","CreationDate","Creator","EditDate","Editor","species","dbh_previous_mm","numeric_tag","hom_alert","lean_direction","comment_mortality","sp","tree_type","NAD83_X","NAD83_Y","personnel_list","personnel","date_measured","multi.stemmed","x","y","gx","gy","dbh_if_dead","mort_status","ExactDate"
"1",1,1,1,1,1,1,1,100005,"old_trees",5,1001,1,12.7,0.3,260,1.3,"NULL","A","","stem not sampled, info automatically filled from previous year info",1,1,255,"DS","","","","","",3,5,0,"W,F","F",NA,NA,1,NA,NA,NA,NA,"5ee36356-4012-463a-a6cf-5db23b420d1e","3/30/2023 4:12:53 PM","shuej21","10/13/2023 1:52:12 PM","shuej21","litu",260,NA,NA,NA,"","litu","1",747578.159903053,4308511.30833298,"KB","KB","10/13/2023 1:52:08 PM",0,-78.1455005200444,38.8906095428615,192.700044535183,0.283658035585437,255,"",2023-10-13
"2",2,2,2,2,2,2,2,100011,"old_trees",11,1001,1,0.7,7.9,967,1.3,"NULL","A","","stem not sampled, info automatically filled from previous year info",1,1,947,"DS","","","","","",3,15,0,"U","U",1,NA,NA,NA,NA,NA,NA,"08595fbb-a199-4463-b904-f28061500120","3/30/2023 4:12:53 PM","shuej21","10/13/2023 1:54:31 PM","shuej21","fram",967,NA,NA,NA,"","fram","1",747565.986827773,4308518.6278974,"KB","KB","10/13/2023 1:54:30 PM",0,-78.1456380709321,38.8906788510274,180.700054225884,7.89089877966422,947,"",2023-10-13
"3",3,3,3,3,3,3,3,10006,"old_trees",61,101,1,7.2,6.5,616,1.3,"NULL","A","AU","",1,1,608,"A","","","","DBH decreased more than expected (-8), check measurement","A",3,100,80,"","",3,NA,NA,NA,NA,NA,NA,"37e289c9-b370-4840-9d82-6dc5e9ffc4b8","3/30/2023 4:12:53 PM","shuej21","7/14/2023 7:31:28 PM","shuej21","juni",616,NA,NA,NA,"","juni","1",747392.568322093,4308513.10321462,"EM","RH,EM","7/14/2023 7:31:03 PM",0,-78.1476372170795,38.8906779694145,7.2000536381791,6.4955820654829,NA,"A",2023-07-14
"4",4,4,4,4,4,4,4,100070,"old_trees",73,1001,1,20,11.7,582,1.3,"F","A","A","",1,1,614,"A","RT,DV","DV","","","A",3,100,100,"","",0,NA,NA,NA,NA,NA,NA,"0659cc66-27b1-44b7-9a50-018b6a1c93cf","3/30/2023 4:12:53 PM","shuej21","10/10/2023 6:49:43 PM","shuej21","litu",582,NA,NA,NA,"","litu","1",747585.1933838,4308522.87457334,"EM","EM","10/10/2023 6:49:41 PM",0,-78.1454153498939,38.8907116609365,199.999960879222,11.6792067420458,NA,"A",2023-10-10
"5",5,5,5,5,5,5,5,100072,"old_trees",75,1001,1,20,12.9,348,1.3,"F","A","A","",1,1,358,"A","","","","","A",3,100,100,"","",0,NA,NA,NA,NA,NA,NA,"d4268190-2ad8-4df4-8e26-909c36384d0f","3/30/2023 4:12:53 PM","shuej21","10/10/2023 6:47:25 PM","shuej21","litu",348,NA,NA,NA,"","litu","1",747585.165576623,4308524.07426272,"EM","EM","10/10/2023 6:47:24 PM",0,-78.1454152376039,38.8907224663561,199.999993130846,12.8792181094619,NA,"A",2023-10-10
"6",6,6,6,6,6,6,6,10009,"old_trees",93,101,1,3.6,10.8,283,1.3,"I","A","A","",1,1,295,"A","","","","","A",3,100,100,"","",0,NA,NA,NA,NA,NA,NA,"a7500ec8-c4cb-43d9-ac4e-3080bbd1435c","3/30/2023 4:12:53 PM","shuej21","7/14/2023 7:32:24 PM","shuej21","caco",283,NA,NA,NA,"","caco","1",747388.869536819,4308517.31850021,"EM","RH,IK,EM","7/14/2023 7:32:03 PM",0,-78.1476782952256,38.8907169497647,3.60005549521264,10.7977138622806,NA,"A",2023-07-14
"7",7,7,7,7,7,7,7,10010,"old_trees",104,101,1,7.3,12.2,629,1.3,"NULL","A","A","",1,1,665,"A","RT","RT","","","A",3,100,100,"","",0,NA,NA,NA,NA,NA,NA,"57145f98-b73b-4ce4-b646-ece268f1904e","3/30/2023 4:12:53 PM","shuej21","7/14/2023 7:33:11 PM","shuej21","juni",629,NA,NA,NA,"","juni","1",747392.536015002,4308518.80396021,"EM","EM","7/14/2023 7:33:08 PM",0,-78.1476355354305,38.8907292871263,7.3000085031826,12.1954815087319,NA,"A",2023-07-14
"8",8,8,8,8,8,8,8,10013,"old_trees",136,102,1,5.5,3.5,268,1.3,"NULL","A","AU","Large liana load >50",1,1,283,"DS","I","I","Dead tree, bark peeling off the tree, affected DBH","","",2,55,0,"I","I",2,NA,NA,NA,NA,0,NA,"ea7968f0-28f4-4c91-9cba-a92b9a351783","3/30/2023 4:12:53 PM","shuej21","8/28/2023 2:26:26 PM","shuej21","fram",268,NA,NA,NA,"Dead tree, bark peeling off the tree, affected DBH; ","fram","1",747390.474340431,4308530.05922256,"IK","CT,RH,IK","8/28/2023 2:26:00 PM",0,-78.147655223794,38.8908311687044,5.50000292744897,23.4966281012284,283,"",2023-08-28
"9",9,9,9,9,9,9,9,100134,"old_trees",141,1002,1,15.8,4.2,348,1.3,"F","A","A","",1,1,379,"A","RT","RT","","","A",3,100,100,"","",0,NA,NA,NA,NA,NA,NA,"d3ae40ac-fb22-4bc2-9e98-ac391449bd9b","3/30/2023 4:12:53 PM","shuej21","10/10/2023 7:07:56 PM","shuej21","litu",348,NA,NA,NA,"","litu","1",747580.704589095,4308535.2738069,"EM","EM","10/10/2023 7:07:45 PM",0,-78.1454625743066,38.8908245227446,195.800027726119,24.1817720512936,NA,"A",2023-10-10
"10",10,10,10,10,10,10,10,100147,"old_trees",154,1002,1,11.8,6.8,253,1.3,"F","A","A","",1,1,269,"A","","","","","A",3,100,100,"","",0,NA,NA,NA,NA,NA,NA,"f3f58bba-fa41-4262-843a-19efbe4438e7","3/30/2023 4:12:53 PM","shuej21","10/10/2023 7:03:11 PM","shuej21","nysy",253,NA,NA,NA,"","nysy","1",747576.645313661,4308537.78028159,"EM","EM","10/10/2023 7:01:33 PM",0,-78.1455084189132,38.8908482255488,191.799993243282,26.7841576711853,NA,"A",2023-10-10
"11",11,11,11,11,11,11,11,10016,"old_trees",167,102,1,5.8,2.8,257,1.3,"NULL","A","A","",1,1,284,"AU","","","","","AU",3,95,85,"LF","LF",1,NA,NA,NA,NA,NA,NA,"2a3b0879-f913-4574-8209-2391337544e8","3/30/2023 4:12:53 PM","shuej21","8/28/2023 2:25:29 PM","shuej21","ceoc",257,NA,NA,NA,"; Leaves all spotty","ceoc","1",747390.790477594,4308529.36628877,"IK","RH,CT,IK","8/28/2023 2:25:16 PM",0,-78.1476518326553,38.8908248430619,5.79997943237188,22.7963657696899,NA,"AU",2023-08-28
"12",12,12,12,12,12,12,12,100168,"old_trees",176,1002,1,17.5,7.1,574,1.3,"F","A","AU","",1,1,578,"AU","RT","RT","","","AU",3,60,60,"DF","DF",3,NA,NA,NA,NA,NA,NA,"0e619252-339e-4400-a5a1-9a57f71449c5","3/30/2023 4:12:53 PM","shuej21","10/10/2023 6:59:49 PM","shuej21","quve",574,NA,NA,NA,"","quve","1",747582.336774016,4308538.2124108,"EM","EM","10/10/2023 6:59:47 PM",0,-78.1454427179501,38.8908505112231,197.49994689114,27.0806932416439,NA,"AU",2023-10-10
"13",13,13,13,13,13,13,13,10021,"old_trees",222,102,1,5.1,10.1,206,1.3,"NULL","A","DS","Lilac ash borer",1,1,206,"DS","","","","","",2,65,0,"I","I",0,NA,NA,NA,NA,0,NA,"dfa482c1-0fa0-46f1-b416-03393648cfad","3/30/2023 4:12:53 PM","shuej21","8/28/2023 3:00:50 PM","shuej21","fram",206,NA,NA,NA,"","fram","1",747389.921273738,4308536.64808261,"IK","CT,RH,IK","8/28/2023 3:00:12 PM",0,-78.1476592194954,38.8908906263598,5.09994197476,30.0967857822487,206,"",2023-08-28
"14",14,14,14,14,14,14,14,100239,"old_trees",254,1001,1,7.1,10.6,100,1.3,"F;L","A","A","",1,1,108,"A","","","","","A",2,100,100,"","",0,NA,NA,NA,NA,NA,NA,"14908b88-cb06-40b4-b989-ee7ff9e8e8e9","3/30/2023 4:12:53 PM","shuej21","10/23/2023 7:08:23 PM","shuej21","cofl",100,NA,NA,NA,"","cofl","1",747572.322418499,4308521.47563179,"CP","CP","10/23/2023 7:08:21 PM",0,-78.1455640812151,38.8907026965121,187.100005213469,10.5870231999794,NA,"A",2023-10-23
"15",15,15,15,15,15,15,15,10035,"old_trees",372,103,1,4.8,10.1,505,1.3,"NULL","A","A","",1,1,530,"A","L","L","","","A",4,95,92,"","",0,17,NA,NA,NA,NA,NA,"f1b1a810-21aa-4016-adb0-9aa393132f3b","3/30/2023 4:12:53 PM","shuej21","8/31/2023 3:26:32 PM","shuej21","acru",505,NA,NA,10,"; 10 degrees north lean","acru","1",747389.157416129,4308556.63576373,"IK","IK","8/31/2023 3:26:31 PM",0,-78.1476608157898,38.8910707372267,4.79998999845095,50.0969857305317,NA,"A",2023-08-31
"16",16,16,16,16,16,16,16,100366,"old_trees",390,1002,1,2.2,12.1,416,1.3,"F","A","A","",1,1,432,"A","DV","DV","","","A",3,100,100,"","",0,NA,NA,NA,NA,NA,NA,"985e6e07-16e5-4b6b-9a97-b577457de865","3/30/2023 4:12:53 PM","shuej21","10/10/2023 7:17:37 PM","shuej21","cagl",416,NA,NA,NA,"","cagl","1",747566.924882506,4308542.85612148,"EM","EM","10/10/2023 7:17:32 PM",0,-78.1456185334652,38.8908966484659,182.199934134448,32.089930417788,NA,"A",2023-10-10
"17",17,17,17,17,17,17,17,100430,"old_trees",460,1002,1,11.4,18.5,189,1.3,"F","A","AU","",1,1,188,"DS","I","I","","","",1,0,0,"B","B",NA,NA,NA,NA,NA,NA,NA,"e6e3d397-5955-4501-9abc-760dfbfbaef2","3/30/2023 4:12:53 PM","shuej21","10/10/2023 7:24:36 PM","shuej21","saal",189,NA,NA,NA,"","saal","1",747575.973970523,4308549.46791728,"EM","EM","10/10/2023 7:24:30 PM",0,-78.1455119367081,38.8909536071337,191.399975662517,38.4844616896247,188,"",2023-10-10
"18",18,18,18,18,18,18,18,10045,"old_trees",481,104,1,0.6,1.2,335,1.3,"I","A","AU","",1,1,324,"AU","DV","DV","Measured on old paint checked dbh twice","DBH decreased more than expected (-11), check measurement","AU",3,95,90,"K","K",1,NA,NA,NA,2,NA,NA,"c71de7ce-5b5f-422c-9f1b-72fcb80cda13","3/30/2023 4:12:53 PM","shuej21","9/5/2023 2:37:49 PM","shuej21","cato",335,NA,NA,NA,"Measured on old paint checked dbh twice; ","cato","1",747384.701037125,4308567.63528868,"IK","IK","9/5/2023 2:37:47 PM",0,-78.1477081749506,38.8911709912907,0.599991573795904,61.1994674302382,NA,"AU",2023-09-05
"19",19,19,19,19,19,19,19,100456,"old_trees",488,1003,1,14.3,1.9,141,1.15,"A;I;F","A","","stem not sampled, info automatically filled from previous year info",1,1,0,"DC","","","","","",NA,NA,NA,"U","U",NA,NA,NA,NA,NA,NA,NA,"4537989e-12d8-4c01-b629-4f603507f75a","3/30/2023 4:12:53 PM","shuej21","10/10/2023 7:28:52 PM","shuej21","ulru",141,NA,NA,NA,"","ulru","1",747578.794310894,4308552.93421869,"EM","EM","10/10/2023 7:28:51 PM",0,-78.1454782067743,38.8909840102898,194.299972706087,41.8826497637465,0,"",2023-10-10
"20",20,20,20,20,20,20,20,100498,"old_trees",532,1003,1,16.7,14.1,152,1.3,"F","A","A","",1,1,163,"A","","","","","A",1,100,100,"","",NA,NA,NA,NA,NA,NA,NA,"00413f1d-47cf-4762-b1b7-2c359d852516","3/30/2023 4:12:53 PM","shuej21","10/10/2023 7:56:40 PM","shuej21","caco",152,NA,NA,NA,"","caco","1",747580.910733623,4308565.18656133,"EM","EM","10/10/2023 7:56:38 PM",0,-78.1454494157714,38.8910936889257,196.700071494169,54.0811448243316,NA,"A",2023-10-10
"21",21,21,21,21,21,21,21,100503,"old_trees",538,1003,1,19.6,19.9,112,1.3,"F","A","A","",1,1,118,"A","","","","","A",2,100,100,"","",0,NA,NA,NA,NA,NA,NA,"381a762e-bf4b-46c9-abd6-4363bb1ab89c","3/30/2023 4:12:53 PM","shuej21","10/11/2023 7:18:54 PM","shuej21","cato",112,NA,NA,NA,"","cato","1",747583.675292856,4308571.05229581,"IK","IK","10/11/2023 7:18:53 PM",0,-78.1454154630541,38.8911457034331,199.599967561154,59.8794138904208,NA,"A",2023-10-11
"22",22,22,22,22,22,22,22,100509,"old_trees",544,1003,1,9,17.6,492,1.3,"F","A","AU","",1,1,503,"A","","","","","A",3,100,100,"","",0,NA,NA,NA,NA,NA,NA,"94855b5c-5ada-48d4-8534-09319d364b05","3/30/2023 4:12:53 PM","shuej21","10/10/2023 7:51:17 PM","shuej21","litu",492,NA,NA,NA,"","litu","1",747573.131467633,4308568.50700993,"EM","EM","10/10/2023 7:51:16 PM",0,-78.1455378081693,38.8911257658991,188.999931270943,57.5858189568339,NA,"A",2023-10-10
"23",23,23,23,23,23,23,23,100516,"old_trees",552,1004,1,17.9,2.2,1060,1.3,"F;I","A","A","",1,1,1089,"A","BT","BT","","","A",3,100,100,"","",0,NA,NA,NA,NA,NA,NA,"1176597d-aad3-4511-879f-9c1cab12a4b4","3/30/2023 4:12:53 PM","shuej21","10/11/2023 7:17:10 PM","shuej21","litu",1060,NA,NA,NA,"","litu","1",747581.922411749,4308573.31229381,"IK","IK","10/11/2023 7:17:09 PM",0,-78.1454348352159,38.8911665380334,197.89998857702,62.180494608308,NA,"A",2023-10-11
"24",24,24,24,24,24,24,24,10053,"old_trees",567,104,1,4.8,1.2,171,1.3,"NULL","A","AU","",1,1,181,"AU","","","","","AU",3,90,85,"K","K",0,NA,NA,NA,1,NA,NA,"aae241f1-e4b5-4913-bf35-ad1c42c6de59","3/30/2023 4:12:53 PM","shuej21","9/5/2023 2:27:14 PM","shuej21","acru",171,NA,NA,NA,"; It looks like the main stem may have previously broken and a new stem grew from the break","acru","1",747388.899908166,4308567.7327647,"IK","IK","9/5/2023 2:27:12 PM",0,-78.1476597836195,38.8911706864401,4.79999390575447,61.1969720394923,NA,"AU",2023-09-05
"25",25,25,25,25,25,25,25,100540,"old_trees",578,1004,1,11.1,8.2,483,1.3,"F;I","A","AU","",1,1,489,"AU","","","","","AU",3,100,100,"W,K","K",0,NA,1,NA,1,NA,NA,"0b458d0f-1439-48d6-862e-7d9c36b9787a","3/30/2023 4:12:53 PM","shuej21","10/11/2023 6:48:58 PM","shuej21","quru",483,NA,NA,NA,"","quru","1",747574.985080814,4308579.15287617,"IK","IK","10/11/2023 6:48:57 PM",0,-78.1455126230038,38.8912210598011,191.100022129362,68.1845483007197,NA,"AU",2023-10-11
"26",26,26,26,26,26,26,26,100542,"old_trees",580,1004,1,14.8,7,105,1.3,"F","A","A","",1,1,112,"A","","","","","A",2,100,100,"","",0,NA,NA,NA,NA,NA,NA,"f7bc2411-ef51-451c-ab45-4cde33e053a1","3/30/2023 4:12:53 PM","shuej21","10/11/2023 7:14:35 PM","shuej21","cato",105,NA,NA,NA,"","cato","1",747578.711892876,4308578.03908578,"IK","IK","10/11/2023 7:14:34 PM",0,-78.1454701048569,38.8912099852661,194.799992009575,66.9823658813568,NA,"A",2023-10-11
"27",27,27,27,27,27,27,27,100550,"old_trees",589,1004,1,19.7,14.6,147,1.3,"F","A","A","",1,1,152,"A","","","","","A",2,100,98,"","",0,NA,NA,NA,NA,NA,NA,"fc2d30bd-d355-4b8b-a38f-cf12ee7ccb03","3/30/2023 4:12:53 PM","shuej21","10/11/2023 6:42:23 PM","shuej21","caco",147,NA,NA,NA,"","caco","1",747583.434326011,4308585.75069403,"IK","IK","10/11/2023 6:42:22 PM",0,-78.1454129387806,38.8912780615591,199.700058000254,74.5793833749572,NA,"A",2023-10-11
"28",28,28,28,28,28,28,28,100551,"old_trees",590,1004,1,16.6,11.2,410,1.3,"F","A","A","",1,1,419,"A","","","","","A",2,100,100,"","",0,NA,NA,NA,NA,NA,NA,"c5af9b06-102e-4432-bb65-df57eb502dd5","3/30/2023 4:12:53 PM","shuej21","10/11/2023 6:44:51 PM","shuej21","quve",410,NA,NA,NA,"","quve","1",747580.413992996,4308582.27969638,"IK","IK","10/11/2023 6:44:49 PM",0,-78.1454489737906,38.8912476725128,196.60001318947,71.1812607207124,NA,"A",2023-10-11
"29",29,29,29,29,29,29,29,100552,"old_trees",591,1004,1,13.8,11.9,458,1.3,"F","A","DS","",1,1,0,"DS","","","","","",2,75,0,"","",0,NA,NA,NA,NA,0,NA,"662cb1dc-a44b-4894-8194-8d9842865800","3/30/2023 4:12:53 PM","shuej21","10/11/2023 6:46:28 PM","shuej21","quru",458,NA,NA,NA,"","quru","1",747577.598505793,4308582.91449583,"IK","IK","10/11/2023 6:46:26 PM",0,-78.1454811694,38.89125417921,193.800010643675,71.8828960646386,0,"",2023-10-11
"30",30,30,30,30,30,30,30,100561,"old_trees",601,1004,1,9.8,18.3,106,1.3,"F","A","A","",1,1,111,"A","","","","","A",2,100,100,"","",0,NA,NA,NA,NA,NA,NA,"1781531e-e814-4886-b46e-db3f9d75fd86","3/30/2023 4:12:53 PM","shuej21","10/11/2023 6:59:23 PM","shuej21","litu",106,NA,NA,NA,"","litu","1",747573.451136753,4308589.21996461,"IK","IK","10/11/2023 6:59:22 PM",0,-78.14552665917,38.8913120989874,189.800040237493,78.2852962988535,NA,"A",2023-10-11
"31",31,31,31,31,31,31,31,100562,"old_trees",602,1004,1,9.1,19.1,649,1.3,"F","A","A","",1,1,669,"A","","","","","A",3,100,97,"","",0,NA,NA,NA,NA,NA,NA,"37307d67-f412-4c42-9fce-c344edd707db","3/30/2023 4:12:53 PM","shuej21","10/11/2023 7:01:42 PM","shuej21","litu",649,NA,NA,NA,"","litu","1",747572.732693696,4308590.00361474,"IK","IK","10/11/2023 7:01:41 PM",0,-78.1455346505798,38.8913193545134,189.099970669916,79.0858251719838,NA,"A",2023-10-11
"32",32,32,32,32,32,32,32,100576,"old_trees",617,1005,1,11.5,1.3,118,1.3,"F","A","A","",1,1,127,"A","","","","","A",2,100,100,"","",0,NA,NA,NA,NA,NA,NA,"fb639b13-10a7-456d-9a37-79efc7c92612","3/30/2023 4:12:53 PM","shuej21","11/7/2023 4:27:35 PM","shuej21","cagl",118,NA,NA,NA,"","cagl","1",747575.12036933,4308592.31531172,"IK","IK","11/7/2023 4:27:25 PM",0,-78.1455063195199,38.8913394877706,191.540633417902,81.3400344593767,NA,"A",2023-11-06
"33",33,33,33,33,33,33,33,100601,"old_trees",645,1003,1,2.8,2,120,1.3,"F","A","A","",1,1,132,"A","","","","","A",1,100,100,"","",0,NA,NA,NA,NA,NA,NA,"278613b1-2949-431f-88cf-52d1d5683729","3/30/2023 4:12:53 PM","shuej21","10/10/2023 7:40:30 PM","shuej21","cato",120,NA,NA,NA,"","cato","1",747567.295118304,4308552.76736499,"EM","EM","10/10/2023 7:40:29 PM",0,-78.1456106965595,38.8909857484968,182.800004118144,41.9895533187136,NA,"A",2023-10-10
"34",34,34,34,34,34,34,34,100603,"old_trees",647,1003,1,6.3,0.8,119,1.3,"F","A","A","",1,1,129,"A","","","","","A",1,100,100,"","",0,NA,NA,NA,NA,NA,NA,"2f25b9b7-ca13-41f3-b296-92df7267bcee","3/30/2023 4:12:53 PM","shuej21","10/10/2023 7:39:18 PM","shuej21","cato",119,NA,NA,NA,"","cato","1",747570.822010897,4308551.64886138,"EM","EM","10/10/2023 7:39:16 PM",0,-78.1455704825906,38.890974687909,186.299998992263,40.7874176033524,NA,"A",2023-10-10
"35",35,35,35,35,35,35,35,100605,"old_trees",649,1003,1,9.8,0.9,127,1.3,"F","A","A","",1,1,140,"A","","","","","A",1,100,100,"","",NA,NA,NA,NA,NA,NA,NA,"b40f8255-b620-4883-9abc-72967b558f99","3/30/2023 4:12:53 PM","shuej21","10/10/2023 7:26:21 PM","shuej21","nysy",127,NA,NA,NA,"","nysy","1",747574.318668451,4308551.83010508,"EM","EM","10/10/2023 7:26:20 PM",0,-78.1455301482468,38.8909753339649,189.799920182114,40.885380627846,NA,"A",2023-10-10
"36",36,36,36,36,36,36,36,100612,"old_trees",656,1003,1,12,4.3,1230,1.4,"A;F","A","A","",1,1,1276,"A","BT,DV","DV","","DBH greater than expected (46), check measurement","A",3,100,100,"","",0,NA,NA,NA,NA,NA,NA,"53fdcb00-0253-4370-97a8-163b7a9e6568","3/30/2023 4:12:53 PM","shuej21","10/10/2023 7:37:09 PM","shuej21","litu",1230,NA,NA,NA,"","litu","1",747576.439284799,4308555.28017085,"EM","EM","10/10/2023 7:37:02 PM",0,-78.1455044824868,38.8910057881533,192.000004870397,44.2839928683499,NA,"A",2023-10-10
"37",37,37,37,37,37,37,37,100647,"old_trees",694,1003,1,1.7,8.6,215,1.3,"F","A","A","",1,1,222,"A","","","","","A",1,100,100,"","",0,NA,NA,NA,NA,NA,NA,"631b2748-5b99-47b4-862a-6df51bcfff2e","3/30/2023 4:12:53 PM","shuej21","10/10/2023 7:43:11 PM","shuej21","caovl",215,NA,NA,NA,"","caovl","1",747566.042331316,4308559.34013246,"EM","EM","10/10/2023 7:43:09 PM",0,-78.145622754638,38.8910452584627,181.700037856456,48.5902780954363,NA,"A",2023-10-10
"38",38,38,38,38,38,38,38,100670,"old_trees",720,1003,1,4.2,17.2,297,1.3,"F","A","A","",1,1,305,"AU","","","","","AU",1,100,100,"AN,K","K",NA,NA,NA,NA,1,NA,NA,"ee8f84f6-adef-4f4d-8ce3-02ed541cd9c4","3/30/2023 4:12:53 PM","shuej21","10/10/2023 7:54:50 PM","shuej21","cagl",297,NA,NA,NA,"","cagl","1",747568.342111899,4308567.99576491,"EM","EM","10/10/2023 7:54:48 PM",0,-78.1455931488655,38.8911225139458,184.20000402071,57.1887176080843,NA,"AU",2023-10-10
"39",39,39,39,39,39,39,39,100680,"old_trees",731,1004,1,1.6,0.9,278,1.3,"F;DS","D","","stem not sampled, info automatically filled from previous year info",1,1,0,"DS","","","","","",2,0,0,"","",0,NA,NA,NA,NA,0,NA,"6a113374-69d7-4257-8ef2-367e31b9084c","3/30/2023 4:12:53 PM","shuej21","10/11/2023 7:09:43 PM","shuej21","cagl",278,NA,NA,NA,"","cagl","1",747565.657000296,4308571.63447927,"IK","IK","10/11/2023 7:09:41 PM",0,-78.1456227600209,38.8911560200576,181.600030684183,60.890313528584,0,"",2023-10-11
"40",40,40,40,40,40,40,40,100700,"old_trees",753,1004,1,6.9,3.6,233,1.3,"F","A","AU","",1,1,232,"A","","","","","A",2,100,100,"","",0,NA,NA,NA,NA,NA,NA,"86aba292-a4bb-49e8-824d-19cdb9df0deb","3/30/2023 4:12:53 PM","shuej21","10/11/2023 7:12:09 PM","shuej21","litu",233,NA,NA,NA,"","litu","1",747570.892883103,4308574.45670687,"IK","IK","10/11/2023 7:12:07 PM",0,-78.145561443732,38.89117994579,186.899977989391,63.5871142239365,NA,"A",2023-10-11
"41",41,41,41,41,41,41,41,100716,"old_trees",769,1004,1,9.5,11.3,723,1.3,"F","A","A","",1,1,749,"A","","","","","A",3,100,97,"","",0,NA,NA,NA,NA,NA,NA,"7f2a83f2-86a8-4cde-8af6-81045c969791","3/30/2023 4:12:53 PM","shuej21","10/11/2023 6:53:33 PM","shuej21","quve",723,NA,NA,NA,"","quve","1",747573.313570542,4308582.21488165,"IK","IK","10/11/2023 6:53:16 PM",0,-78.1455307689651,38.8912490897816,189.499998085892,71.2854724441968,NA,"A",2023-10-11
"42",42,42,42,42,42,42,42,100719,"old_trees",772,1004,1,1.7,10.5,359,1.3,"F","A","A","",1,1,365,"A","","","","","A",2,100,100,"","",0,NA,NA,NA,NA,NA,NA,"087701b3-8540-4b09-b82e-8ab656d82468","3/30/2023 4:12:53 PM","shuej21","10/11/2023 7:08:57 PM","shuej21","litu",359,NA,NA,NA,"","litu","1",747565.534179603,4308581.23419311,"IK","IK","10/11/2023 7:08:56 PM",0,-78.1456207136538,38.8912424551362,181.699949610439,70.4902310077262,NA,"A",2023-10-11
"43",43,43,43,43,43,43,43,100720,"old_trees",774,1004,1,1.7,11.9,413,1.3,"F;M","A","A","",1,1,424,"A","","","","","A",3,100,100,"","",0,NA,NA,NA,NA,NA,NA,"0a245e1a-342c-45b3-878e-6faba06a1147","3/30/2023 4:12:53 PM","shuej21","10/11/2023 7:04:39 PM","shuej21","litu",413,NA,NA,NA,"","litu","1",747565.501677471,4308582.63376648,"IK","IK","10/11/2023 7:04:38 PM",1,-78.1456205833974,38.8912550608985,181.699925337335,71.8901814885395,NA,"A",2023-10-11
"44",44,44,44,44,44,44,44,100727,"old_trees",780,1004,1,6.5,13.6,125,1.3,"F","A","A","",1,1,132,"A","","","","","A",2,100,100,"","",0,NA,NA,NA,NA,NA,NA,"11ebd60e-bc6a-4627-ad1d-825ce2648979","3/30/2023 4:12:53 PM","shuej21","10/11/2023 6:55:22 PM","shuej21","litu",125,NA,NA,NA,"","litu","1",747570.261024758,4308584.44467985,"IK","IK","10/11/2023 6:55:21 PM",0,-78.1455651196313,38.8912700187432,186.500003602782,73.5872972354739,NA,"A",2023-10-11
"45",45,45,45,45,45,45,45,100754,"old_trees",810,1005,1,3.8,6.7,446,1.3,"F","A","A","",1,1,461,"AU","","","","","AU",3,100,100,"W,R","R",0,NA,1,1,NA,NA,NA,"d673a181-fce8-46a7-af8c-08fb124a9f15","3/30/2023 4:12:53 PM","shuej21","10/11/2023 6:38:06 PM","shuej21","quru",446,NA,NA,NA,"; Multiple small wounds","quru","1",747567.257778498,4308597.47863511,"IK","IK","10/11/2023 6:38:04 PM",0,-78.1455950074624,38.8913881746467,183.799944168554,86.6890446018476,NA,"AU",2023-10-11
"46",46,46,46,46,46,46,46,100769,"old_trees",826,1005,1,11,15.3,652,1.3,"F","A","A","",1,1,664,"A","","","","","A",3,92,80,"","",0,NA,NA,NA,NA,NA,NA,"ebca1cea-0a84-4ec8-a64d-62d4ace62d2f","3/30/2023 4:12:53 PM","shuej21","10/11/2023 6:26:10 PM","shuej21","quve",652,NA,NA,NA,"","quve","1",747574.256426141,4308606.24326146,"IK","IK","10/11/2023 6:26:08 PM",0,-78.145511247668,38.8914650871509,191.000041322861,95.2846021669499,NA,"A",2023-10-11
"47",47,47,47,47,47,47,47,100771,"old_trees",829,1005,1,8.5,16.9,960,1.3,"F","A","A","",1,1,1020,"A","DV,I","I","","DBH greater than expected (60), check measurement","A",3,95,85,"","",0,NA,NA,NA,NA,NA,NA,"b3d42d53-5bf5-4a35-9a0c-8d3c14b7593f","3/30/2023 4:12:53 PM","shuej21","10/11/2023 6:33:06 PM","shuej21","quru",960,NA,NA,NA,"","quru","1",747571.719888178,4308607.78491139,"IK","IK","10/11/2023 6:33:04 PM",0,-78.1455399039158,38.89147967718,188.499951229723,96.8861913514325,NA,"A",2023-10-11
"48",48,48,48,48,48,48,48,100782,"old_trees",841,1006,1,4.2,1.5,662,1.3,"F","A","A","",1,1,679,"A","","","","","A",3,100,95,"","",NA,NA,NA,NA,NA,NA,NA,"55f157a5-7b90-42d0-814e-03378d02bdd0","3/30/2023 4:12:53 PM","shuej21","10/11/2023 6:27:15 PM","shuej21","litu",662,NA,NA,NA,"","litu","1",747567.3144259,4308612.28387115,"EM","EM","10/11/2023 6:27:00 PM",0,-78.1455890174895,38.8915214105046,184.200047317026,101.48873765779,NA,"A",2023-10-11
"49",49,49,49,49,49,49,49,100783,"old_trees",842,1006,1,7.3,1.3,294,1.3,"F","A","A","",1,1,307,"A","","","","","A",1,100,100,"","",0,NA,NA,NA,NA,NA,NA,"7a491137-0cff-4b12-a1c0-c676708695ed","3/30/2023 4:12:53 PM","shuej21","10/11/2023 6:24:36 PM","shuej21","litu",294,NA,NA,NA,"","litu","1",747570.418168885,4308612.1558243,"EM","EM","10/11/2023 6:24:31 PM",0,-78.1455533193496,38.8915193835486,187.299984365259,101.286850123577,NA,"A",2023-10-11
"50",50,50,50,50,50,50,50,100791,"old_trees",851,1006,1,1,5.2,109,1.3,"F","A","A","",1,1,106,"A","","","","","A",1,100,90,"","",NA,NA,NA,NA,NA,NA,NA,"71f699b9-39f0-431c-93da-c3f516e73ac2","3/30/2023 4:12:53 PM","shuej21","10/11/2023 6:41:40 PM","shuej21","nysy",109,NA,NA,NA,"","nysy","1",747564.02938173,4308615.9086,"EM","EM","10/11/2023 6:41:38 PM",0,-78.1456255429755,38.8915549597784,180.999978426325,105.190631942696,NA,"A",2023-10-11
"51",51,51,51,51,51,51,51,100795,"old_trees",855,1006,1,4.7,7.3,216,1.3,"F","A","A","",1,1,215,"A","","","","","A",1,100,100,"","",NA,NA,NA,NA,NA,NA,NA,"0af191f7-9d0b-4c91-9ee2-d779e94ed911","3/30/2023 4:12:53 PM","shuej21","10/11/2023 6:29:00 PM","shuej21","nysy",216,NA,NA,NA,"","nysy","1",747567.679731027,4308618.09387979,"EM","EM","10/11/2023 6:28:47 PM",0,-78.1455827158064,38.8915735994974,184.700042212798,107.288405009787,NA,"A",2023-10-11
"52",52,52,52,52,52,52,52,100799,"old_trees",859,1006,1,8.7,5.5,140,1.3,"F","A","A","",1,1,139,"A","","","","","A",1,100,100,"","",0,NA,NA,NA,NA,NA,NA,"eece7d59-b2f2-4d33-8f3c-6411b77b84a5","3/30/2023 4:12:53 PM","shuej21","10/11/2023 6:23:01 PM","shuej21","litu",140,NA,NA,NA,"","litu","1",747571.720402498,4308616.38716021,"EM","EM","10/11/2023 6:23:00 PM",0,-78.1455367966393,38.8915570999974,188.700031492813,105.485990734764,NA,"A",2023-10-11
"53",53,53,53,53,53,53,53,10080,"old_trees",860,104,1,3.7,13.4,100,1.3,"NULL","A","A","",1,1,145,"A","DV","DV","","DBH greater than expected (45), check measurement","A",3,97,95,"","",0,NA,NA,NA,NA,NA,NA,"36ea02d8-34f4-45ff-82ae-1003948e5766","3/30/2023 4:12:53 PM","shuej21","9/6/2023 1:41:39 PM","shuej21","prse",100,NA,NA,NA,"","prse","1",747387.51722969,4308579.90397634,"IK","IK","9/6/2023 1:41:38 PM",0,-78.1476713224688,38.8912806206941,3.70005105590975,73.397646579358,NA,"A",2023-09-06
"54",54,54,54,54,54,54,54,100818,"old_trees",880,1005,1,17.3,18.3,210,1.3,"NULL","A","A","",1,1,210,"A","","","","","A",2,100,100,"","",1,NA,NA,NA,NA,NA,NA,"36eaba66-819f-45cb-822e-9c1fe612b277","3/30/2023 4:12:53 PM","shuej21","10/11/2023 6:22:27 PM","shuej21","nysy",210,NA,NA,NA,"","nysy","1",747580.485121861,4308609.38858534,"IK","IK","10/11/2023 6:22:25 PM",0,-78.1454383808446,38.8914916410388,197.300029939395,98.2807761293719,NA,"A",2023-10-11
"55",55,55,55,55,55,55,55,100834,"old_trees",896,1006,1,16.1,5.5,211,1.3,"F","A","","stem not sampled, info automatically filled from previous year info",1,1,211,"A","","","","","A",1,100,100,"","",NA,NA,NA,NA,NA,NA,NA,"8f0649a7-3c1b-42f0-b333-f19e3f57f498","3/30/2023 4:12:53 PM","shuej21","10/11/2023 6:52:53 PM","shuej21","nysy",211,NA,NA,NA,"","nysy","1",747579.118380776,4308616.55886449,"EM","EM","10/11/2023 6:52:52 PM",0,-78.1454515357655,38.8915565609181,196.100002098127,105.481555700147,NA,"A",2023-10-11
"56",56,56,56,56,56,56,56,100839,"old_trees",901,1006,1,15.2,10.4,225,1.3,"F;M","A","","stem not sampled, info automatically filled from previous year info",1,1,205,"DS","","","","","",1,15,0,"U","U",0,NA,NA,NA,NA,NA,NA,"f93a7dcb-2b27-4a3f-a176-69a27df7f4af","3/30/2023 4:12:53 PM","shuej21","10/11/2023 6:17:20 PM","shuej21","nysy",225,NA,NA,NA,"; Dead for more than a year","nysy","1",747578.104919791,4308621.43667961,"EM","EM","10/11/2023 6:17:18 PM",1,-78.1454614486688,38.8916007483537,195.199975732622,110.382111780622,205,"",2023-10-11
"57",57,57,57,57,57,57,57,100855,"old_trees",919,1006,1,14,16.1,641,1.3,"F","A","A","",1,1,655,"A","","","","","A",3,100,100,"","",1,NA,NA,NA,NA,NA,NA,"8f27f23f-afd8-465d-b2ab-eb9b2b7ba9d9","3/30/2023 4:12:53 PM","shuej21","10/11/2023 6:13:35 PM","shuej21","litu",641,NA,NA,NA,"","litu","1",747576.773039218,4308627.10732027,"EM","EM","10/11/2023 6:13:34 PM",0,-78.1454747428293,38.8916521611884,194.000008469592,116.082847971688,NA,"A",2023-10-11
"58",58,58,58,58,58,58,58,100861,"old_trees",925,1006,1,20,18.5,183,1.3,"F","A","A","",1,1,185,"A","","","","","A",1,100,100,"","",NA,NA,NA,NA,NA,NA,NA,"a97536fc-110d-4c64-bc31-a6ba8b04b2e8","3/30/2023 4:12:53 PM","shuej21","10/11/2023 6:11:21 PM","shuej21","litu",183,NA,NA,NA,"","litu","1",747582.715726097,4308629.64582208,"EM","EM","10/11/2023 6:11:20 PM",0,-78.1454053884179,38.8916733340445,199.99998737987,118.479179537418,NA,"A",2023-10-11
"59",59,59,59,59,59,59,59,100866,"old_trees",930,1107,1,0,0.8,162,1.3,"F","A","A","",1,1,159,"DS","R","R","","","",2,70,0,"DF","DF",0,NA,NA,NA,NA,1,NA,"e98e4d32-c479-497b-a9ab-c6d9a9068c2a","3/30/2023 4:12:53 PM","shuej21","10/11/2023 6:11:20 PM","shuej21","litu",162,NA,NA,NA,"","litu","1",747582.662382925,4308631.94518138,"IK","IK","10/11/2023 6:11:17 PM",0,-78.1454051737193,38.8916940440336,200.00000207179,120.779157078233,159,"",2023-10-11
"60",60,60,60,60,60,60,60,100868,"old_trees",932,1007,1,17.6,0.4,653,1.3,"F","A","A","",1,1,665,"A","","","","","A",3,100,97,"","",0,NA,NA,NA,NA,NA,NA,"b421d075-2b6b-4041-9315-bb1bbdf1de47","3/30/2023 4:12:53 PM","shuej21","10/11/2023 6:13:27 PM","shuej21","litu",653,NA,NA,NA,"","litu","1",747580.272306722,4308631.48962191,"IK","IK","10/11/2023 6:13:26 PM",0,-78.1454328633813,38.891690617308,197.600000476473,120.38061656079,NA,"A",2023-10-11
"61",61,61,61,61,61,61,61,100874,"old_trees",939,1007,1,19.2,3.9,352,1.3,"F","A","A","",1,1,361,"A","","","","","A",3,100,100,"","",0,NA,NA,NA,NA,NA,NA,"2747c461-d79f-43a5-944b-c2f9d529bd4f","3/30/2023 4:12:53 PM","shuej21","10/11/2023 6:07:31 PM","shuej21","litu",352,NA,NA,NA,"","litu","1",747581.790674324,4308635.02583316,"IK","IK","10/11/2023 6:07:29 PM",0,-78.1454141020704,38.8917220164935,199.199997022377,123.879684924156,NA,"A",2023-10-11
"62",62,62,62,62,62,62,62,100881,"old_trees",947,1007,1,17.3,10.9,635,1.3,"F","A","A","",1,1,651,"A","","","","","A",3,97,97,"","",0,NA,NA,NA,NA,NA,NA,"de8c4481-dd3a-47cd-b28a-adab2023bde7","3/30/2023 4:12:53 PM","shuej21","10/11/2023 5:57:20 PM","shuej21","litu",635,NA,NA,NA,"","litu","1",747579.72884089,4308641.97988253,"IK","IK","10/11/2023 5:57:18 PM",0,-78.1454353400298,38.8917851860941,197.300047530946,130.880840947174,NA,"A",2023-10-11
"63",63,63,63,63,63,63,63,100887,"old_trees",953,1007,1,15.4,15.5,333,1.3,"F","A","A","",1,1,333,"A","","","","","A",2,100,100,"","",0,NA,NA,NA,NA,NA,NA,"a5853f92-d601-403e-b135-0ce3007e0949","3/30/2023 4:12:53 PM","shuej21","10/11/2023 5:44:40 PM","shuej21","litu",333,NA,NA,NA,"","litu","1",747577.722624837,4308646.53458488,"IK","IK","10/11/2023 5:44:39 PM",0,-78.1454568025693,38.8918267451404,195.400037300083,135.482005888169,NA,"A",2023-10-11
"64",64,64,64,64,64,64,64,100890,"old_trees",957,1007,1,18.6,14.6,677,1.3,"F","A","A","",1,1,692,"A","","","","","A",3,100,100,"","",0,NA,NA,NA,NA,NA,NA,"cc892eb5-e705-4b54-8928-9785e5e16f42","3/30/2023 4:12:53 PM","shuej21","10/11/2023 5:46:44 PM","shuej21","litu",677,NA,NA,NA,"","litu","1",747580.942575257,4308645.70899886,"IK","IK","10/11/2023 5:46:43 PM",0,-78.1454200174686,38.8918184073221,198.599968092101,134.580010777912,NA,"A",2023-10-11
"65",65,65,65,65,65,65,65,100891,"old_trees",958,1007,1,19.6,15.9,355,1.3,"F","A","A","",1,1,355,"A","","","","","A",3,100,100,"","",0,NA,NA,NA,NA,NA,NA,"b9e67ffc-4541-4042-a282-148f80645bc0","3/30/2023 4:12:53 PM","shuej21","10/11/2023 5:48:08 PM","shuej21","litu",355,NA,NA,NA,"","litu","1",747581.912222153,4308647.03187571,"IK","IK","10/11/2023 5:48:06 PM",0,-78.1454083735088,38.8918300404113,199.600043823257,135.879432770475,NA,"A",2023-10-11
"66",66,66,66,66,66,66,66,100892,"old_trees",959,1007,1,20,17,119,1.3,"F;M","A","A","",1,1,125,"A","","","","","A",2,100,100,"","",0,NA,NA,NA,NA,NA,NA,"c1c8ad7a-e6cb-4e52-8f89-3ceaf0934a80","3/30/2023 4:12:53 PM","shuej21","10/11/2023 5:51:25 PM","shuej21","caca",119,NA,NA,NA,"","caca","1",747582.286466757,4308648.14089028,"IK","IK","10/11/2023 5:51:18 PM",1,-78.1454036636426,38.8918399164399,199.999916056476,136.979225166328,NA,"A",2023-10-11
"67",67,67,67,67,67,67,67,100893,"old_trees",960,1007,1,19.2,19,454,1.3,"F","A","A","",1,1,454,"A","","","","","A",3,100,100,"","",0,NA,NA,NA,NA,NA,NA,"8f4cadb7-8141-4a9b-9d15-0ab3ada08aba","3/30/2023 4:12:53 PM","shuej21","10/11/2023 5:54:44 PM","shuej21","litu",454,NA,NA,NA,"","litu","1",747581.440375389,4308650.12177721,"IK","IK","10/11/2023 5:54:42 PM",0,-78.1454126935038,38.8918579834516,199.200007578635,138.97968998844,NA,"A",2023-10-11
"68",68,68,68,68,68,68,68,100904,"old_trees",972,1008,1,11.4,2,329,1.3,"F","A","A","",1,1,329,"A","","","","","A",1,100,100,"","",NA,NA,NA,NA,NA,NA,NA,"4a5ecaff-ab5d-403e-8688-dee074c6cf4d","3/30/2023 4:12:53 PM","shuej21","10/11/2023 6:03:49 PM","shuej21","litu",329,NA,NA,NA,"","litu","1",747573.572934874,4308652.93998516,"EM","EM","10/11/2023 6:03:47 PM",0,-78.145502283356,38.8918855650043,191.400064934153,141.984364547961,NA,"A",2023-10-11
"69",69,69,69,69,69,69,69,100905,"old_trees",973,1008,1,10,1.5,679,1.3,"F","A","A","",1,1,693,"A","","","","","A",3,100,100,"","",NA,NA,NA,NA,NA,NA,NA,"3782abb4-8ff1-45de-96fd-4112b7c36109","3/30/2023 4:12:53 PM","shuej21","10/11/2023 6:02:42 PM","shuej21","litu",679,NA,NA,NA,"","litu","1",747572.184782554,4308652.40773537,"EM","EM","10/11/2023 6:02:40 PM",0,-78.1455184620095,38.8918811657178,189.999938403278,141.485307107714,NA,"A",2023-10-11
"70",70,70,70,70,70,70,70,100906,"old_trees",974,1008,1,9.3,1,500,1.3,"F","A","A","",1,1,506,"A","","","","","A",3,100,100,"","",NA,NA,NA,NA,NA,NA,NA,"622a8801-c3b3-4933-ad02-efeacc1886ef","3/30/2023 4:12:53 PM","shuej21","10/11/2023 6:05:13 PM","shuej21","litu",500,NA,NA,NA,"","litu","1",747571.496583902,4308651.89157192,"EM","EM","10/11/2023 6:05:12 PM",0,-78.1455265737943,38.8918767139916,189.299950346245,140.985670767637,NA,"A",2023-10-11
"71",71,71,71,71,71,71,71,100911,"old_trees",980,1008,1,16.3,4.9,496,1.3,"F","A","A","",1,1,507,"A","","","","","A",3,100,100,"","",0,NA,NA,NA,NA,NA,NA,"d34a1de6-000d-4f09-8767-307006b34eef","3/30/2023 4:12:53 PM","shuej21","10/11/2023 5:57:53 PM","shuej21","litu",496,NA,NA,NA,"","litu","1",747578.404276835,4308655.95290944,"EM","EM","10/11/2023 5:57:52 PM",0,-78.1454455565583,38.8919113209631,196.300004298608,144.88143699817,NA,"A",2023-10-11
"72",72,72,72,72,72,72,72,100912,"old_trees",981,1008,1,18.2,5.7,498,1.3,"F","A","A","",1,1,504,"A","","","","","A",3,100,100,"","",0,NA,NA,NA,NA,NA,NA,"fbbab011-9e5a-47cc-91d0-2388b1e2cc18","3/30/2023 4:12:53 PM","shuej21","10/11/2023 5:56:27 PM","shuej21","litu",498,NA,NA,NA,"","litu","1",747580.285237995,4308656.79680033,"EM","EM","10/11/2023 5:56:25 PM",0,-78.1454235900611,38.8919183862478,198.200036888112,145.680317147704,NA,"A",2023-10-11
"73",73,73,73,73,73,73,73,100915,"old_trees",984,1008,1,19.1,10.1,117,1.3,"F","A","A","",1,1,127,"A","","","","","A",1,100,95,"","",0,NA,NA,NA,NA,NA,NA,"ce65eecd-6349-4150-89b4-eb8c4046fdca","3/30/2023 4:12:53 PM","shuej21","10/11/2023 5:54:08 PM","shuej21","caca",117,NA,NA,NA,"","caca","1",747581.08289438,4308661.21647424,"EM","EM","10/11/2023 5:54:07 PM",0,-78.1454128102785,38.8919579399475,199.100011897526,150.079752619465,NA,"A",2023-10-11
"74",74,74,74,74,74,74,74,100916,"old_trees",985,1008,1,14.2,8.3,450,1.3,"F","A","A","",1,1,456,"A","","","","","A",3,100,100,"","",0,NA,NA,NA,NA,NA,NA,"fefec189-0bd2-4fab-ad5f-b257b7b1a2ec","3/30/2023 4:12:53 PM","shuej21","10/11/2023 5:53:12 PM","shuej21","litu",450,NA,NA,NA,"","litu","1",747576.22601948,4308659.30330978,"EM","EM","10/11/2023 5:53:09 PM",0,-78.1454694346675,38.8919420893862,194.20006011499,148.282736154308,NA,"A",2023-10-11
"75",75,75,75,75,75,75,75,100919,"old_trees",988,1008,1,15.7,13.5,195,1.3,"F","A","A","",1,1,196,"A","","","","","A",1,100,100,"","",0,NA,NA,NA,NA,NA,NA,"4095e739-4066-4979-ac00-5a8f7bda61b8","3/30/2023 4:12:53 PM","shuej21","10/11/2023 5:51:18 PM","shuej21","caovl",195,NA,NA,NA,"","caovl","1",747577.604902243,4308664.53666873,"EM","EM","10/11/2023 5:51:16 PM",0,-78.1454516677904,38.8919888027412,195.699981987731,153.481791476983,NA,"A",2023-10-11
"76",76,76,76,76,76,76,76,100921,"old_trees",991,1008,1,20,13.2,475,1.3,"F","A","A","",1,1,480,"A","","","","","A",3,100,100,"","",NA,NA,NA,NA,NA,NA,NA,"220cfd30-faf0-4967-ad4a-1fff61ca7995","3/30/2023 4:12:53 PM","shuej21","10/11/2023 5:55:08 PM","shuej21","litu",475,NA,NA,NA,"","litu","1",747581.910707777,4308664.33649354,"EM","EM","10/11/2023 5:55:07 PM",0,-78.1454021517691,38.8919857878476,199.999984735298,153.179183897389,NA,"A",2023-10-11
"77",77,77,77,77,77,77,77,100924,"old_trees",994,1008,1,19.3,18.2,222,1.3,"F","A","DS","",1,1,222,"DS","I","I","","","",1,50,0,"","",0,NA,NA,NA,NA,NA,NA,"82e2e3de-d82f-4415-90e1-a3ad460faa58","3/30/2023 4:12:53 PM","shuej21","10/11/2023 5:46:04 PM","shuej21","litu",222,NA,NA,NA,"","litu","1",747581.094906225,4308669.31889324,"EM","EM","10/11/2023 5:46:01 PM",0,-78.1454097506129,38.8920308608846,199.299990893315,158.179590129809,222,"",2023-10-11
"78",78,78,78,78,78,78,78,100927,"old_trees",997,1008,1,13.1,18.6,225,1.3,"F","A","AU","",1,1,219,"DS","I","I","","","",1,60,0,"U","U",0,NA,NA,NA,NA,NA,NA,"0ad1952c-a264-41cf-ada3-133a385bf18e","3/30/2023 4:12:53 PM","shuej21","10/11/2023 5:44:12 PM","shuej21","litu",225,NA,NA,NA,"","litu","1",747574.887308225,4308669.57496955,"EM","EM","10/11/2023 5:44:07 PM",0,-78.1454811486893,38.8920349147674,193.100004393393,158.58335047545,219,"",2023-10-11
"79",79,79,79,79,79,79,79,100928,"old_trees",998,1008,1,17.6,19.9,229,1.3,"F","A","A","",1,1,230,"A","","","","","A",1,100,100,"","",0,NA,NA,NA,NA,NA,NA,"99b52c03-da7e-4ef8-91fd-bdc4493a1756","3/30/2023 4:12:53 PM","shuej21","10/11/2023 5:47:07 PM","shuej21","litu",229,NA,NA,NA,"","litu","1",747579.355910211,4308670.97902747,"EM","EM","10/11/2023 5:47:06 PM",0,-78.1454291793689,38.8920462926168,197.599976850556,159.88064652403,NA,"A",2023-10-11
"80",80,80,80,80,80,80,80,100929,"old_trees",999,1008,1,12.9,15.8,182,1.3,"F","A","","stem not sampled, info automatically filled from previous year info",1,1,185,"A","","","","","A",1,100,100,"","",NA,NA,NA,NA,NA,NA,NA,"c97e6281-a298-408d-a8a4-e39ce15c405d","3/30/2023 4:12:53 PM","shuej21","10/11/2023 5:41:51 PM","shuej21","cato",182,NA,NA,NA,"","cato","1",747574.75231472,4308666.77106754,"EM","EM","10/11/2023 5:41:48 PM",0,-78.1454837142786,38.8920097168019,192.899998679688,155.783456066606,NA,"A",2023-10-11
"81",81,81,81,81,81,81,81,100930,"old_trees",1001,1008,1,10.1,19.1,112,1.3,"F;M","A","A","",1,1,112,"A","","","","","A",1,90,85,"","",NA,NA,NA,NA,NA,NA,NA,"a146630d-7d1e-4280-9924-2d31fa26e729","3/30/2023 4:12:53 PM","shuej21","10/10/2023 6:45:55 PM","shuej21","caca",112,NA,NA,NA,"","caca","1",747571.876466726,4308670.00516068,"RH","RH","10/10/2023 6:45:53 PM",1,-78.1455156682398,38.8920396349727,190.099953361489,159.085085400906,NA,"A",2023-10-10
"82",82,82,82,82,82,82,82,100932,"old_trees",1003,1008,1,10.4,14.9,424,1.3,"F","A","A","",1,1,429,"A","","","","","A",3,100,100,"","",0,NA,NA,NA,NA,NA,NA,"c48c642f-344f-4605-9ef5-a8ce1077ef82","3/30/2023 4:12:53 PM","shuej21","10/11/2023 5:40:48 PM","shuej21","litu",424,NA,NA,NA,"","litu","1",747572.273916327,4308665.81331181,"EM","EM","10/11/2023 5:40:46 PM",0,-78.1455126022931,38.8920017950234,190.40004806771,154.884963861513,NA,"A",2023-10-11
"83",83,83,83,83,83,83,83,100934,"old_trees",1005,1009,1,14.2,2.9,105,1.3,"F;M","A","A","",1,1,135,"A","","","","","A",2,100,96,"","",NA,NA,NA,NA,NA,NA,NA,"7564c34f-a04f-4960-b917-3ce41b7994c4","3/30/2023 4:12:53 PM","shuej21","10/10/2023 7:00:27 PM","shuej21","caca",105,NA,NA,NA,"; Crown leaning towards 0 degrees North","caca","1",747575.887167475,4308673.89927683,"RH","RH","10/10/2023 7:00:01 PM",3,-78.1454680746103,38.8920735531683,194.199915408413,162.882633401638,NA,"A",2023-10-10
"84",84,84,84,84,84,84,84,100936,"old_trees",1007,1009,1,11.6,1.7,360,1.3,"F","A","A","",1,1,367,"A","","","","","A",3,100,100,"","",NA,NA,NA,NA,NA,NA,NA,"282e1e38-168f-40d3-9ada-d0b76d4f3f67","3/30/2023 4:12:53 PM","shuej21","10/10/2023 6:50:51 PM","shuej21","litu",360,NA,NA,NA,"","litu","1",747573.315816813,4308672.63929271,"RH","RH","10/10/2023 6:50:00 PM",0,-78.1454981421125,38.8920629374347,191.600026060227,161.684210936659,NA,"A",2023-10-10
"85",85,85,85,85,85,85,85,100941,"old_trees",1013,1009,1,14.6,6.4,460,1.3,"F","A","A","",1,1,473,"A","","","","","A",3,95,85,"","",NA,NA,NA,NA,NA,NA,NA,"93f284fa-cfb5-451a-bee9-d817d1662e3b","3/30/2023 4:12:53 PM","shuej21","10/10/2023 7:08:35 PM","shuej21","litu",460,NA,NA,NA,"","litu","1",747576.20602842,4308677.407705,"RH","RH","10/10/2023 7:08:26 PM",0,-78.1454631374691,38.8921050402824,194.600083585199,166.382477869329,NA,"A",2023-10-10
"86",86,86,86,86,86,86,86,100942,"old_trees",1014,1009,1,16.2,7.3,281,1.3,"F","A","DS","",1,1,288,"DS","I","I","Trunk covered in shelf fungi","","",2,15,0,"","",NA,NA,NA,NA,NA,NA,NA,"ed43563e-5255-4ee9-a82c-d5367b765b2f","3/30/2023 4:12:53 PM","shuej21","10/10/2023 7:03:28 PM","shuej21","qupr",281,NA,NA,NA,"Trunk covered in shelf fungi; ","qupr","1",747577.784626931,4308678.34451587,"RH","RH","10/10/2023 7:03:03 PM",0,-78.145444619603,38.892113027074,196.199990581418,167.28144866337,288,"",2023-10-10
"87",87,87,87,87,87,87,87,100943,"old_trees",1015,1009,1,13.2,8.4,479,1.3,"F","A","","stem not sampled, info automatically filled from previous year info",1,1,494,"A","","","","","A",3,100,100,"","",NA,NA,NA,NA,NA,NA,NA,"646d3e8b-1975-484b-8721-ccce6581eab4","3/30/2023 4:12:53 PM","shuej21","10/10/2023 7:13:23 PM","shuej21","litu",479,NA,NA,NA,"","litu","1",747574.782472942,4308679.43413012,"RH","RH","10/10/2023 7:13:14 PM",0,-78.1454788013866,38.8921236798594,193.22392287005,168.442213091569,NA,"A",2023-10-10
"88",88,88,88,88,88,88,88,100944,"old_trees",1016,1109,1,0,6,242,1.3,"F","A","A","",1,1,243,"AU","","","","","AU",2,100,97,"K","K",0,NA,NA,NA,1,NA,NA,"060c4d00-17fd-40a7-aeb3-b1ba2424c113","3/30/2023 4:12:53 PM","shuej21","10/13/2023 6:57:36 PM","shuej21","litu",242,NA,NA,NA,"","litu","1",747581.613824567,4308677.13311658,"IK","IK","10/13/2023 6:57:35 PM",0,-78.1454009570029,38.8921010451355,200.000054021341,165.979247957626,NA,"AU",2023-10-13
"89",89,89,89,89,89,89,89,100950,"old_trees",1023,1009,1,18,15,459,1.3,"F","A","A","",1,1,468,"A","","","","","A",3,100,95,"","",NA,NA,NA,NA,NA,NA,NA,"9d16712f-7de1-434e-8d2f-dce17c1d5c72","3/30/2023 4:12:53 PM","shuej21","10/10/2023 7:25:54 PM","shuej21","cagl",459,NA,NA,NA,"","cagl","1",747579.405470546,4308686.08415881,"RH","RH","10/10/2023 7:25:46 PM",0,-78.1454231624464,38.8921822295883,197.999952198643,174.980318614418,NA,"A",2023-10-10
"90",90,90,90,90,90,90,90,100952,"old_trees",1025,1009,1,13.3,15.5,703,1.2,"F","A","A","",1,1,712,"A","A","A","","","A",3,97,95,"","",NA,NA,NA,NA,NA,NA,NA,"d6502278-af7b-41ba-931e-cc05dfdb23d8","3/30/2023 4:12:53 PM","shuej21","10/10/2023 7:22:00 PM","shuej21","litu",703,NA,1.2,NA,"","litu","1",747574.695193723,4308686.47512649,"RH","RH","10/10/2023 7:21:46 PM",0,-78.1454772679589,38.8921870756377,193.300013271925,175.48329207216,NA,"A",2023-10-10
"91",91,91,91,91,91,91,91,100953,"old_trees",1026,1009,1,9.1,11.2,121,1.3,"F","A","A","",1,1,131,"A","","","","","A",2,97,95,"","",NA,NA,NA,NA,NA,NA,NA,"c263360a-b4fb-4456-a48a-c97110ae110a","3/30/2023 4:12:53 PM","shuej21","10/10/2023 6:30:54 PM","shuej21","cato",121,NA,NA,NA,"","cato","1",747570.596088937,4308682.07881538,"RH","RH","10/10/2023 6:30:52 PM",0,-78.1455260608392,38.8921486624375,189.100020413299,171.185795629843,NA,"A",2023-10-10
"92",92,92,92,92,92,92,92,100954,"old_trees",1027,1009,1,9.1,16,223,1.3,"F","A","A","",1,1,227,"A","","","","","A",1,100,100,"","",NA,NA,NA,NA,NA,NA,NA,"69b386ee-7535-485c-af4c-9ce84460521f","3/30/2023 4:12:53 PM","shuej21","10/10/2023 6:06:55 PM","shuej21","litu",223,NA,NA,NA,"","litu","1",747570.484707754,4308686.87747062,"RH","RH","10/10/2023 6:06:43 PM",0,-78.1455256134756,38.8921918832314,189.099994610442,175.985742466021,NA,"A",2023-10-10
"93",93,93,93,93,93,93,93,100955,"old_trees",1028,1010,1,16.7,6.7,316,1.3,"F","A","A","",1,1,314,"A","","","","","A",2,100,100,"","",NA,NA,NA,NA,NA,NA,NA,"0770d092-9b10-4c45-93d4-3465a8781661","3/30/2023 4:12:53 PM","shuej21","10/10/2023 3:22:44 PM","shuej21","quru",316,NA,NA,NA,"","quru","1",747577.834395489,4308697.75086675,"RH","RH","10/10/2023 3:22:42 PM",0,-78.1454370494914,38.8922876763161,196.69995934316,186.681116706744,NA,"A",2023-10-10
"94",94,94,94,94,94,94,94,100956,"old_trees",1029,1010,1,11.7,1.2,165,1.3,"F","A","A","",1,1,177,"A","","","","","A",1,100,100,"","",NA,NA,NA,NA,NA,NA,NA,"ac48c915-0479-447d-9d73-f94298861295","3/30/2023 4:12:53 PM","shuej21","10/10/2023 3:26:51 PM","shuej21","fagr",165,NA,NA,NA,"","fagr","1",747572.963389165,4308692.13638513,"RH","RH","10/10/2023 3:26:50 PM",0,-78.1454951713737,38.8922385167147,191.70001200299,181.18416810707,NA,"A",2023-10-10
"95",95,95,95,95,95,95,95,100957,"old_trees",1030,1010,1,9.4,2.4,228,1.3,"F","A","A","",1,1,231,"A","","","","","A",2,100,97,"","",NA,NA,NA,NA,NA,NA,NA,"7cbc2e40-c07c-46fb-a955-876f65cbd8e0","3/30/2023 4:12:53 PM","shuej21","10/10/2023 3:44:26 PM","shuej21","qupr",228,NA,NA,NA,"","qupr","1",747570.636129082,4308693.28270629,"RH","RH","10/10/2023 3:44:11 PM",0,-78.1455215602746,38.8922494897072,189.399972117674,182.385559185604,NA,"A",2023-10-10
"96",96,96,96,96,96,96,96,100960,"old_trees",1034,1010,1,13.8,10.4,608,1.3,"F","A","A","",1,1,650,"A","DV","DV","","DBH greater than expected (42), check measurement","A",3,98,93,"","",NA,NA,NA,NA,NA,NA,NA,"a21c775b-cca3-41a7-b563-b2a190487631","3/30/2023 4:12:53 PM","shuej21","10/10/2023 3:24:17 PM","shuej21","quru",608,NA,NA,NA,"","quru","1",747574.849382582,4308701.38268927,"RH","RH","10/10/2023 3:24:05 PM",0,-78.1454701173629,38.8923212049514,193.800005532821,190.382961142043,NA,"A",2023-10-10
"97",97,97,97,97,97,97,97,100961,"old_trees",1035,1010,1,18.3,14.1,234,1.6,"A;F","A","AU","",1,1,161,"AU","A,DV","DV","POM moved to a point that better represents living biomass","DBH decreased more than expected (-73), check measurement","AU",1,99,98,"W,R","R",NA,NA,3,3,NA,NA,NA,"19189ba5-23f4-4994-80ca-c31a72c847bd","3/30/2023 4:12:53 PM","shuej21","10/10/2023 3:13:46 PM","shuej21","cagl",234,NA,1.6,NA,"POM moved to a point that better represents living biomass; ","cagl","1",747579.262272606,4308705.1860649,"RH","RH","10/10/2023 3:13:35 PM",0,-78.1454179243607,38.8923541930992,198.299943494165,194.080221210448,NA,"AU",2023-10-10
"98",98,98,98,98,98,98,98,100963,"old_trees",1037,1010,1,11.1,14.6,204,1.3,"F","A","A","",1,1,208,"AU","","","","","AU",1,100,95,"K","K",NA,NA,NA,NA,1,NA,NA,"57420472-3cf0-48f7-8c23-392756867526","3/30/2023 4:12:53 PM","shuej21","10/10/2023 3:58:49 PM","shuej21","caovl",204,NA,NA,NA,"","caovl","1",747572.052711318,4308705.51890707,"RH","RH","10/10/2023 3:58:48 PM",0,-78.1455008343439,38.8923592202264,191.10004428898,194.584574950815,NA,"AU",2023-10-10
"99",99,99,99,99,99,99,99,100964,"old_trees",1038,1010,1,8.5,10.7,367,1.3,"F","A","A","",1,1,386,"A","","","","","A",3,100,100,"","",NA,NA,NA,NA,NA,NA,NA,"6dc18291-0bb7-4481-856e-9d3a783e56b3","3/30/2023 4:12:53 PM","shuej21","10/10/2023 3:55:31 PM","shuej21","cagl",367,NA,NA,NA,"","cagl","1",747569.543802337,4308701.55956767,"RH","RH","10/10/2023 3:55:30 PM",0,-78.1455311560708,38.892324291847,188.499956684078,190.686075720019,NA,"A",2023-10-10
"100",100,100,100,100,100,100,100,100974,"old_trees",1049,1011,1,18.3,4.2,188,1.3,"F","A","A","",1,1,194,"A","","","","","A",1,100,100,"","",0,NA,NA,NA,NA,NA,NA,"a1db9c0c-6722-4de3-a553-2a19d2e219d8","3/30/2023 4:12:53 PM","shuej21","7/13/2023 5:57:14 PM","shuej21","cagl",188,NA,NA,NA,"","cagl","1",747579.027980829,4308715.28327074,"EM","KB,EM","7/13/2023 5:57:01 PM",0,-78.1454169820225,38.8924451371422,198.299962800198,204.1801430473,NA,"A",2023-07-13
"101",101,101,101,101,101,101,101,100976,"old_trees",1051,1011,1,14.6,5.2,126,1.3,"F","A","A","",1,1,126,"A","","","","","A",1,100,98,"","",0,NA,NA,NA,NA,NA,NA,"3154d942-9558-4695-b7de-8ccb26f2500d","3/30/2023 4:12:53 PM","shuej21","7/13/2023 5:56:11 PM","shuej21","cato",126,NA,NA,NA,"","cato","1",747575.305771314,4308716.19721986,"EM","KB,EM","7/13/2023 5:56:01 PM",0,-78.1454595199324,38.8924544117908,194.599958052244,205.182431259552,NA,"A",2023-07-13
"102",102,102,102,102,102,102,102,100979,"old_trees",1054,1011,1,10.9,0.3,223,1.3,"F","A","A","",1,1,228,"A","","","","","A",3,100,95,"","",0,NA,NA,NA,NA,NA,NA,"0a6bb353-f752-440a-8a81-4c1d1ac9e745","3/30/2023 4:12:53 PM","shuej21","7/13/2023 5:55:20 PM","shuej21","cato",223,NA,NA,NA,"","cato","1",747571.713932652,4308711.22018901,"EM","KB,EM","7/13/2023 5:55:16 PM",0,-78.1455026803779,38.8924106290158,190.893622505071,200.292305392522,NA,"A",2023-07-13
"103",103,103,103,103,103,103,103,100980,"old_trees",1056,1011,1,9.7,9.4,643,1.3,"F;M","A","A","",1,1,668,"A","","","","","A",3,90,85,"","",0,NA,NA,NA,NA,NA,NA,"c94c4a33-c4b9-485b-9e08-80c19bba0959","3/30/2023 4:12:53 PM","shuej21","7/13/2023 6:03:07 PM","shuej21","litu",643,NA,NA,NA,"","litu","1",747570.309741254,4308720.28236513,"EM","KB,EM","7/13/2023 6:03:00 PM",1,-78.1455155846678,38.8924925871081,189.700045099871,209.385337331224,NA,"A",2023-07-13
"104",104,104,104,104,104,104,104,100985,"old_trees",1061,1011,1,13.7,14.5,183,1.3,"F;M","A","A","",1,1,193,"A","","","","","A",1,98,98,"","",0,NA,NA,NA,NA,NA,NA,"36805639-039c-40c2-934d-5c0b45e8ce45","3/30/2023 4:12:53 PM","shuej21","7/13/2023 5:58:31 PM","shuej21","fagr",183,NA,NA,NA,"","fagr","1",747574.190329082,4308725.4739042,"EM","KB,EM","7/13/2023 5:58:01 PM",2,-78.1454690214049,38.8925382191662,193.700028538109,214.483037683612,NA,"A",2023-07-13
"105",105,105,105,105,105,105,105,100986,"old_trees",1062,1011,1,12.6,14.5,338,1.3,"F","A","A","",1,1,348,"A","","","","","A",3,95,95,"","",0,NA,NA,NA,NA,NA,NA,"01dc8540-6414-455e-baa5-b2d476254282","3/30/2023 4:12:53 PM","shuej21","7/13/2023 6:00:55 PM","shuej21","cagl",338,NA,NA,NA,"","cagl","1",747573.090610452,4308725.44833167,"EM","KB,EM","7/13/2023 6:00:16 PM",0,-78.1454816957313,38.8925382988733,192.600012621322,214.483648492985,NA,"A",2023-07-13
"106",106,106,106,106,106,106,106,100987,"old_trees",1063,1011,1,8.6,18.4,448,1.3,"F","A","A","",1,1,478,"A","","","","","A",3,100,100,"","",0,NA,NA,NA,NA,NA,NA,"bef92e99-b5e6-4a8b-99db-666d6620634e","3/30/2023 4:12:53 PM","shuej21","7/13/2023 6:01:41 PM","shuej21","litu",448,NA,NA,NA,"","litu","1",747569.001193442,4308729.25445967,"EM","KB,EM","7/13/2023 6:01:11 PM",0,-78.1455274199629,38.8925737074875,188.599995710596,218.386036653543,NA,"A",2023-07-13
"107",107,107,107,107,107,107,107,100989,"old_trees",1065,1011,1,4.4,13.7,100,1.3,"F","A","A","",1,1,102,"A","","","","","A",1,100,98,"","",0,NA,NA,NA,NA,NA,NA,"b1f99407-5a2b-41eb-8a3b-fc8c66134654","3/30/2023 4:12:53 PM","shuej21","7/13/2023 5:46:33 PM","shuej21","caovl",100,NA,NA,NA,"","caovl","1",747564.91142951,4308724.45831472,"EM","KB,EM","7/13/2023 5:46:06 PM",0,-78.1455762496743,38.892531693015,184.400065330011,213.688597316016,NA,"A",2023-07-13
"108",108,108,108,108,108,108,108,100990,"old_trees",1067,1011,1,5.5,11.4,664,1.3,"F","A","A","",1,1,685,"A","","","","","A",3,90,88,"","",0,NA,NA,NA,NA,NA,NA,"afdb84c2-2b7b-47cc-8133-70ac7e409c25","3/30/2023 4:12:53 PM","shuej21","7/13/2023 5:48:21 PM","shuej21","qual",664,NA,NA,NA,"","qual","1",747566.064415003,4308722.18439611,"EM","KB,EM","7/13/2023 5:48:06 PM",0,-78.1455637909448,38.8925109021646,185.49998720758,211.387878967538,NA,"A",2023-07-13
"109",109,109,109,109,109,109,109,100993,"old_trees",1069,1012,1,16.7,0.5,292,1.3,"F","A","A","",1,1,298,"AU","","","POM changed to 1.3 on uphill side of tree","","AU",1,100,95,"K","K",0,NA,NA,NA,1,NA,NA,"9c9c4c08-f48d-43dc-8ed7-4d63adb64f0f","3/30/2023 4:12:53 PM","shuej21","7/13/2023 6:11:13 PM","shuej21","cato",292,NA,NA,NA,"POM changed to 1.3 on uphill side of tree;","cato","1",747577.050287421,4308731.54177073,"EM","KB,EM","7/13/2023 6:11:10 PM",0,-78.1454338963864,38.8925920260135,196.6999873554,220.481110790512,NA,"AU",2023-07-13
"110",110,110,110,110,110,110,110,100996,"old_trees",1072,1012,1,10.3,1.7,112,1.3,"F","A","A","",1,1,115,"A","","","","","A",1,98,92,"","",0,NA,NA,NA,NA,NA,NA,"cfeded02-12d1-4762-b4e9-d879838cc5cf","3/30/2023 4:12:53 PM","shuej21","7/13/2023 6:06:08 PM","shuej21","cato",112,NA,NA,NA,"","cato","1",747570.624167744,4308732.59301119,"EM","KB,EM","7/13/2023 6:06:04 PM",0,-78.1455075249786,38.8926032982023,190.2999852369,221.685011377311,NA,"A",2023-07-13
"111",111,111,111,111,111,111,111,100997,"old_trees",1073,1012,1,10.1,5.7,125,1.3,"F","A","A","",1,1,127,"AU","","","","","AU",1,98,95,"K","K",0,NA,NA,NA,2,NA,NA,"f7ecdf37-1eec-4c99-8ce2-9fe1fc6868e1","3/30/2023 4:12:53 PM","shuej21","7/13/2023 6:17:33 PM","shuej21","litu",125,NA,NA,NA,"","litu","1",747570.331419052,4308736.58728951,"EM","KB,EM","7/13/2023 6:17:00 PM",0,-78.1455094563536,38.8926393304509,190.099979763537,225.685126205922,NA,"AU",2023-07-13
"112",112,112,112,112,112,112,112,101000,"old_trees",1077,1012,1,18.7,6.8,104,1.3,"F","A","A","",1,1,106,"A","","","","","A",1,100,92,"","",0,NA,NA,NA,NA,NA,NA,"c7f1da6a-4bd6-401f-8e74-9a1b0bc1478b","3/30/2023 4:12:53 PM","shuej21","7/13/2023 6:12:34 PM","shuej21","cato",104,NA,NA,NA,"","cato","1",747578.903626171,4308737.88652468,"EM","KB,EM","7/13/2023 6:12:06 PM",0,-78.14541026441,38.8926486085646,198.700021096549,226.77995297809,NA,"A",2023-07-13
"113",113,113,113,113,113,113,113,101005,"old_trees",1082,1006,1,7.2,8.9,616,1.1,"F;I","A","AU","",1,1,618,"A","","","","","A",3,100,100,"","",0,NA,NA,NA,NA,NA,NA,"f8cdf4dd-8a56-4caf-851b-a031ee3b03a4","3/30/2023 4:12:53 PM","shuej21","10/11/2023 6:19:25 PM","shuej21","nysy",616,NA,NA,NA,"","nysy","1",747570.141931327,4308619.75146203,"EM","EM","10/11/2023 6:19:20 PM",0,-78.1455537622146,38.8915878245247,187.200034570707,108.886911008798,NA,"A",2023-10-11
"114",114,114,114,114,114,114,114,101008,"old_trees",1084,1006,1,4.2,11.5,177,1.3,"F;M","A","A","",1,1,190,"A","","","","","A",1,100,80,"","",NA,NA,NA,NA,NA,NA,NA,"1e7d59bb-e69d-4d54-848b-8926eb602bd4","3/30/2023 4:12:53 PM","shuej21","10/11/2023 6:32:51 PM","shuej21","tiam",177,NA,NA,NA,"","tiam","1",747567.08242814,4308622.28120656,"EM","EM","10/11/2023 6:32:01 PM",5,-78.1455880850328,38.8916114550571,184.2000430997,111.488762749726,NA,"A",2023-10-11
"115",115,115,115,115,115,115,115,101010,"old_trees",1087,1006,1,1.5,11.4,133,1.3,"F","A","A","",1,1,130,"A","","","","","A",1,90,70,"","",NA,NA,NA,NA,NA,NA,NA,"e7c49fb8-1223-4716-90f7-880b4dcee092","3/30/2023 4:12:53 PM","shuej21","10/11/2023 6:44:21 PM","shuej21","nysy",133,NA,NA,NA,"","nysy","1",747564.385364583,4308622.11862485,"EM","EM","10/11/2023 6:44:16 PM",0,-78.1456192044613,38.8916107516731,181.499933649336,111.390424071309,NA,"A",2023-10-11
"116",116,116,116,116,116,116,116,101012,"old_trees",1089,1006,1,0.6,15,164,1.3,"F","A","A","",1,1,167,"A","","","","","A",1,100,90,"","",NA,NA,NA,NA,NA,NA,NA,"6007183f-1aaa-40f5-afe0-456676e40208","3/30/2023 4:12:53 PM","shuej21","10/11/2023 6:45:30 PM","shuej21","litu",164,NA,NA,NA,"","litu","1",747563.402226216,4308625.6967065,"EM","EM","10/11/2023 6:45:29 PM",0,-78.1456292368413,38.8916432325416,180.600068844463,114.990893166588,NA,"A",2023-10-11
"117",117,117,117,117,117,117,117,101019,"old_trees",1096,1006,1,9.4,13.5,336,1.3,"F;DS","D","","stem not sampled, info automatically filled from previous year info",1,1,0,"DS","","","","","",1,10,0,"","",NA,NA,NA,NA,NA,NA,NA,"e7d6ae06-bac2-46ae-b623-df2a18087ea4","3/30/2023 4:12:53 PM","shuej21","10/11/2023 6:30:50 PM","shuej21","nysy",336,NA,NA,NA,"","nysy","1",747572.234640006,4308624.40132561,"EM","EM","10/11/2023 6:30:48 PM",0,-78.1455279850629,38.8916290851305,189.400053561263,113.485645398806,0,"",2023-10-11
"118",118,118,118,118,118,118,118,101025,"old_trees",1102,1007,1,5.5,2.1,205,1.3,"F","A","A","",1,1,210,"A","","","","","A",2,100,100,"","",0,NA,NA,NA,NA,NA,NA,"e1c6dd57-ff88-4ce2-ab43-0090fef4dd0c","3/30/2023 4:12:53 PM","shuej21","10/11/2023 6:05:06 PM","shuej21","litu",205,NA,NA,NA,"","litu","1",747568.136074869,4308632.90848293,"IK","IK","10/11/2023 6:05:04 PM",0,-78.1455721192742,38.8917068070398,185.499951537517,122.087948728989,NA,"A",2023-10-11
"119",119,119,119,119,119,119,119,101031,"old_trees",1108,1007,1,10.1,4.2,314,1.3,"F","A","A","",1,1,316,"A","","","","","A",2,100,100,"","",0,NA,NA,NA,NA,NA,NA,"36b12955-ee37-4ab3-83b2-41fb2bc11a7b","3/30/2023 4:12:53 PM","shuej21","10/11/2023 6:03:07 PM","shuej21","cagl",314,NA,NA,NA,"","cagl","1",747572.686218057,4308635.11462714,"IK","IK","10/11/2023 6:03:05 PM",0,-78.1455189219567,38.8917253809949,190.100051084493,124.185162933256,NA,"A",2023-10-11
"120",120,120,120,120,120,120,120,101035,"old_trees",1112,1007,1,4.7,7.8,614,1.3,"F","A","A","",1,1,639,"A","","","","","A",3,97,97,"","",0,NA,NA,NA,NA,NA,NA,"52d03f54-a174-4096-a234-8c8c857b409d","3/30/2023 4:12:53 PM","shuej21","10/11/2023 6:18:53 PM","shuej21","litu",614,NA,NA,NA,"","litu","1",747567.204141641,4308638.58837371,"IK","IK","10/11/2023 6:18:51 PM",0,-78.1455808041804,38.8917581904317,184.700038573148,127.788412655293,NA,"A",2023-10-11
"121",121,121,121,121,121,121,121,101041,"old_trees",1118,1007,1,12.5,8.6,277,1.3,"F","A","A","",1,1,280,"A","","","","","A",2,100,100,"","",0,NA,NA,NA,NA,NA,NA,"80011f42-070b-472a-ac78-db98891b5501","3/30/2023 4:12:53 PM","shuej21","10/11/2023 6:00:59 PM","shuej21","cagl",277,NA,NA,NA,"","cagl","1",747574.983395277,4308639.5691365,"IK","IK","10/11/2023 6:00:58 PM",0,-78.14549086039,38.891764825728,192.499951504876,128.5837315802,NA,"A",2023-10-11
"122",122,122,122,122,122,122,122,101049,"old_trees",1126,1007,1,3.2,12.4,376,1.3,"F","A","A","",1,1,386,"A","","","","","A",3,100,100,"","",0,NA,NA,NA,NA,NA,NA,"3350963a-3328-4725-88dc-4703d9a7e0fe","3/30/2023 4:12:53 PM","shuej21","10/11/2023 5:40:44 PM","shuej21","litu",376,NA,NA,NA,"","litu","1",747565.597792983,4308643.15233543,"IK","IK","10/11/2023 5:40:42 PM",0,-78.1455976583639,38.8917997201276,183.200002927767,132.389316491112,NA,"A",2023-10-11
"123",123,123,123,123,123,123,123,101065,"old_trees",1144,1008,1,4.7,4.5,186,1.3,"F","A","A","",1,1,185,"A","","","","","A",2,100,80,"","",1,NA,NA,NA,NA,NA,NA,"486a3e8a-27fa-45cd-83a9-1c4063503c65","3/30/2023 4:12:53 PM","shuej21","10/11/2023 6:08:02 PM","shuej21","litu",186,NA,NA,NA,"","litu","1",747566.816664639,4308655.28391647,"EM","EM","10/11/2023 6:08:01 PM",0,-78.145579247391,38.8919085647725,184.699990627451,144.488448165005,NA,"A",2023-10-11
"124",124,124,124,124,124,124,124,101069,"old_trees",1148,1008,1,11.1,9.9,736,1.3,"F;M","A","A","",1,1,760,"A","","","","","A",3,100,100,"","",NA,NA,NA,NA,NA,NA,NA,"789a4ead-66a6-44eb-9f80-e98037ad521f","3/30/2023 4:12:53 PM","shuej21","10/11/2023 5:59:34 PM","shuej21","litu",736,NA,NA,NA,"","litu","1",747573.089712445,4308660.83090942,"EM","EM","10/11/2023 5:59:32 PM",1,-78.1455050034493,38.8919567219679,191.100036414746,149.88455507047,NA,"A",2023-10-11
"125",125,125,125,125,125,125,125,101070,"old_trees",1149,1008,1,6,9.8,106,1.3,"F","A","A","",1,1,114,"A","","","","","A",1,100,100,"","",NA,NA,NA,NA,NA,NA,NA,"bbd66831-fd39-416d-a358-6cbd1d023f9e","3/30/2023 4:12:53 PM","shuej21","10/10/2023 7:52:20 PM","shuej21","fagr",106,NA,NA,NA,"","fagr","1",747567.993430347,4308660.61263756,"RH","RH","10/10/2023 7:52:18 PM",0,-78.145563773912,38.891956193385,186.000062176684,149.787649505865,NA,"A",2023-10-10
"126",126,126,126,126,126,126,126,101071,"old_trees",1150,1008,1,6,10.1,115,1.3,"F","A","A","",1,1,125,"A","","","","","A",1,100,100,"","",NA,NA,NA,NA,NA,NA,NA,"ce6cc184-e158-4edc-a089-d7ecd57e090c","3/30/2023 4:12:53 PM","shuej21","10/10/2023 7:53:51 PM","shuej21","fagr",115,NA,NA,NA,"","fagr","1",747567.986382717,4308660.91251286,"RH","RH","10/10/2023 7:53:50 PM",0,-78.1455637469624,38.8919588943432,185.999973338406,150.087607595952,NA,"A",2023-10-10
"127",127,127,127,127,127,127,127,101072,"old_trees",1151,1008,1,4,10.8,186,1.3,"F","A","A","",1,1,185,"A","","","","","A",2,75,73,"","",NA,NA,NA,NA,NA,NA,NA,"c6c989d7-9d1b-47b2-95b7-d00c853fbd2d","3/30/2023 4:12:53 PM","shuej21","10/10/2023 7:58:39 PM","shuej21","litu",186,NA,NA,NA,"","litu","1",747565.970719222,4308661.56589792,"RH","RH","10/10/2023 7:58:19 PM",0,-78.1455867249615,38.8919653429423,184.000010409451,150.78878544815,NA,"A",2023-10-10
"128",128,128,128,128,128,128,128,101075,"old_trees",1154,1008,1,3,13,366,1.3,"F","A","A","",1,1,373,"A","","","","","A",2,100,100,"","",NA,NA,NA,NA,NA,NA,NA,"8cf58e6c-c65b-4b83-9a0d-0545e5274d87","3/30/2023 4:12:53 PM","shuej21","10/10/2023 7:47:53 PM","shuej21","qupr",366,NA,NA,NA,"","qupr","1",747564.919923103,4308663.74219909,"RH","RH","10/10/2023 7:47:50 PM",0,-78.1455980419327,38.8919852264084,182.999985747293,152.989481640609,NA,"A",2023-10-10
"129",129,129,129,129,129,129,129,101077,"old_trees",1156,1008,1,10.4,13.3,482,1.3,"F","A","A","",1,1,496,"A","","","","","A",4,98,98,"","",NA,NA,NA,NA,NA,NA,NA,"78e3797b-88f1-41b5-86ed-7a09ca473f3e","3/30/2023 4:12:53 PM","shuej21","10/27/2023 7:41:53 PM","shuej21","litu",482,NA,NA,NA,"","litu","1",747572.310967215,4308664.21370196,"CP","CP","10/27/2023 7:41:52 PM",0,-78.1455127523126,38.8919873875903,190.399979167503,153.284925304987,NA,"A",2023-10-27
"130",130,130,130,130,130,130,130,101079,"old_trees",1158,1008,1,2.7,13.7,105,1.3,"F;M","A","A","",1,1,101,"A","DV","DV","","","A",1,90,87,"","",NA,NA,NA,NA,NA,NA,NA,"91c8f279-ffd0-4278-bc3c-2202436b785d","3/30/2023 4:12:53 PM","shuej21","10/10/2023 7:41:29 PM","shuej21","caca",105,NA,NA,NA,"","caca","1",747564.603779442,4308664.43495985,"RH","RH","10/10/2023 7:41:28 PM",2,-78.1456014330714,38.8919915505493,182.699998731878,153.689571151009,NA,"A",2023-10-10
"131",131,131,131,131,131,131,131,101080,"old_trees",1159,1008,1,1.4,16.7,485,1.3,"F","A","A","",1,1,499,"A","","","","","A",3,90,85,"","",NA,NA,NA,NA,NA,NA,NA,"416ef303-e000-4acc-b795-d470a63f7afa","3/30/2023 4:12:53 PM","shuej21","10/10/2023 7:37:30 PM","shuej21","litu",485,NA,NA,NA,"","litu","1",747563.234488186,4308667.40408273,"RH","RH","10/10/2023 7:37:01 PM",0,-78.1456161321982,38.8920186593975,181.399957555348,156.690445427515,NA,"A",2023-10-10
"132",132,132,132,132,132,132,132,101082,"old_trees",1161,909,1,20,0.6,828,1.3,"F","A","A","",1,1,837,"A","BT","BT","","","A",3,100,97,"","",NA,NA,NA,NA,NA,NA,NA,"76b3f68a-d388-4fa5-a305-5391c129f421","3/30/2023 4:12:53 PM","shuej21","10/10/2023 7:32:37 PM","shuej21","litu",828,NA,NA,NA,"","litu","1",747561.744364797,4308671.27048541,"RH","RH","10/10/2023 7:32:29 PM",0,-78.1456318994209,38.892053878091,179.999933022351,160.591221398649,NA,"A",2023-10-10
"133",133,133,133,133,133,133,133,101087,"old_trees",1166,1009,1,8.1,2.3,233,1.3,"F","A","DS","",1,1,215,"DS","I","I","","","",1,10,0,"","",NA,NA,NA,NA,NA,NA,NA,"6f9de318-1e7b-4708-9505-5ef1c4c0d3b8","3/30/2023 4:12:53 PM","shuej21","10/10/2023 6:41:25 PM","shuej21","litu",233,NA,NA,NA,"","litu","1",747569.802837935,4308673.15801706,"RH","RH","10/10/2023 6:41:21 PM",0,-78.1455384126756,38.8920685959454,188.10002670225,162.286406144389,215,"",2023-10-10
"134",134,134,134,134,134,134,134,10109,"old_trees",1169,101,1,15.1,2,127,1.3,"NULL","A","A","",1,1,135,"AU","","","","","AU",1,100,100,"K","K",4,NA,NA,NA,2,NA,NA,"dac937f7-7923-465e-876d-c7659eea0b7f","3/30/2023 4:12:53 PM","shuej21","7/14/2023 7:28:39 PM","shuej21","caco",127,NA,NA,NA,"","caco","1",747400.570482561,4308508.78770307,"EM","RH,EM","7/14/2023 7:28:00 PM",0,-78.1475466157255,38.8906368753604,15.0999435941227,1.99082144919098,NA,"AU",2023-07-14
"135",135,135,135,135,135,135,135,101094,"old_trees",1174,1009,1,7.6,5.9,681,1.3,"F","A","A","No tag. Not sure right tree",1,1,703,"A","RT","RT","","","A",3,98,95,"","",NA,NA,NA,NA,NA,NA,NA,"aaccd790-cd70-4ed6-996e-7be8f129168f","3/30/2023 4:12:53 PM","shuej21","10/10/2023 6:35:56 PM","shuej21","litu",681,NA,NA,NA,"","litu","1",747569.219402242,4308676.74540268,"RH","RH","10/10/2023 6:35:42 PM",0,-78.1455438384962,38.8921010479378,187.599972840653,165.886662629703,NA,"A",2023-10-10
"136",136,136,136,136,136,136,136,101095,"old_trees",1175,1009,1,9,8.5,279,1.3,"F;DS","D","","stem not sampled, info automatically filled from previous year info",1,1,0,"DS","","","","","",1,25,0,"","",NA,NA,NA,NA,NA,NA,NA,"b75ddaf5-a157-4c42-a4a6-8d469324a9fe","3/30/2023 4:12:53 PM","shuej21","10/10/2023 6:16:28 PM","shuej21","qupr",279,NA,NA,NA,"","qupr","1",747570.558671388,4308679.37717578,"RH","RH","10/10/2023 6:16:26 PM",0,-78.1455274658054,38.8921243573716,188.999936808437,168.485812089738,0,"",2023-10-10
"137",137,137,137,137,137,137,137,101096,"old_trees",1176,1009,1,7.1,9.7,112,1.3,"F","A","A","",1,1,114,"A","","","","","A",2,100,97,"","",NA,NA,NA,NA,NA,NA,NA,"21342446-be60-4d14-a7db-15740ac65588","3/30/2023 4:12:53 PM","shuej21","10/10/2023 6:13:36 PM","shuej21","cagl",112,NA,NA,NA,"","cagl","1",747568.63142029,4308680.53283727,"RH","RH","10/10/2023 6:13:35 PM",0,-78.1455492445537,38.8921353017149,187.100014939477,169.687019627015,NA,"A",2023-10-10
"138",138,138,138,138,138,138,138,101098,"old_trees",1178,1009,1,8.1,15.1,520,1.3,"F;M","A","A","",1,1,533,"A","","","","","A",3,100,100,"","",NA,NA,NA,NA,NA,NA,NA,"4d8d9e95-2d6d-41bb-84e2-432eec64090b","3/30/2023 4:12:53 PM","shuej21","10/10/2023 5:59:00 PM","shuej21","litu",520,NA,NA,NA,"","litu","1",747569.505900442,4308685.95446719,"RH","RH","10/10/2023 5:58:58 PM",1,-78.1455372188077,38.8921838517006,188.100037708801,175.086298640989,NA,"A",2023-10-10
"139",139,139,139,139,139,139,139,101099,"old_trees",1179,1009,1,3.1,14.5,112,1.3,"F","A","A","",1,1,118,"A","","","","","A",3,100,95,"","",NA,NA,NA,NA,NA,NA,NA,"b17c8ccc-daaa-4c92-ac29-1f2754e8c620","3/30/2023 4:12:53 PM","shuej21","10/10/2023 5:53:32 PM","shuej21","cato",112,NA,NA,NA,"","cato","1",747564.521072851,4308685.2386987,"RH","RH","10/10/2023 5:53:31 PM",0,-78.1455948852415,38.8921788140787,183.099946411681,174.489384501709,NA,"A",2023-10-10
"140",140,140,140,140,140,140,140,101100,"old_trees",1180,1010,1,1.1,0.4,179,1.3,"F","A","A","",1,1,195,"A","","","","","A",1,100,99,"","",NA,NA,NA,NA,NA,NA,NA,"f14d7858-32ec-4653-a48b-0edd5c89e646","3/30/2023 4:12:53 PM","shuej21","10/10/2023 3:40:22 PM","shuej21","fagr",179,NA,NA,NA,"","fagr","1",747562.384795308,4308691.09067537,"RH","RH","10/10/2023 3:40:18 PM",0,-78.1456173781475,38.8922320856255,181.100005540151,180.390552017935,NA,"A",2023-10-10
"141",141,141,141,141,141,141,141,101103,"old_trees",1183,1010,1,6.4,2,393,1.3,"F","A","DS","",1,1,389,"DS","","","","","",3,70,0,"","",NA,NA,NA,NA,NA,NA,NA,"e6ed99b0-0627-47eb-96e5-1b2bb319e53f","3/30/2023 4:12:53 PM","shuej21","10/10/2023 3:36:33 PM","shuej21","qupr",393,NA,NA,NA,"","qupr","1",747567.646208555,4308692.81318989,"RH","RH","10/10/2023 3:36:31 PM",0,-78.1455561633689,38.892246106358,186.399963848793,181.987343510119,389,"",2023-10-10
"142",142,142,142,142,142,142,142,101104,"old_trees",1184,1010,1,7.7,0.6,111,1.3,"F","A","A","",1,1,113,"A","","","","","A",1,100,98,"","",NA,NA,NA,NA,NA,NA,NA,"f38d176e-4a68-46f8-8f81-7b585b18d42d","3/30/2023 4:12:53 PM","shuej21","10/10/2023 3:33:10 PM","shuej21","caovl",111,NA,NA,NA,"","caovl","1",747568.978364587,4308691.44383488,"RH","RH","10/10/2023 3:33:08 PM",0,-78.145541315121,38.8922334063811,187.699993278337,180.586667775866,NA,"A",2023-10-10
"143",143,143,143,143,143,143,143,101106,"old_trees",1186,1010,1,5.4,5,174,1.3,"F","A","A","",1,1,177,"A","","","","","A",1,100,99,"","",NA,NA,NA,NA,NA,NA,NA,"2e90461b-23bb-458c-93f3-4f317e513cb2","3/30/2023 4:12:53 PM","shuej21","10/10/2023 3:43:12 PM","shuej21","cato",174,NA,NA,NA,"","cato","1",747566.576931774,4308695.78920749,"RH","RH","10/10/2023 3:43:10 PM",0,-78.1455674048811,38.892273192735,185.400016354101,184.987969448502,NA,"A",2023-10-10
"144",144,144,144,144,144,144,144,101107,"old_trees",1187,1010,1,7.8,7.5,355,1.3,"F","A","A","",1,1,360,"AU","I","I","Stem very irregular - large wound","","AU",2,100,99,"W,R","R",NA,NA,3,3,NA,NA,NA,"df05b2d0-14eb-4179-8af4-12591e4a8352","3/30/2023 4:12:53 PM","shuej21","10/10/2023 3:50:28 PM","shuej21","caovl",355,NA,NA,NA,"Stem very irregular - large wound; ","caovl","1",747568.91826823,4308698.34420802,"RH","RH","10/10/2023 3:50:20 PM",0,-78.1455395193853,38.8922955288486,187.799996865813,187.486516339785,NA,"AU",2023-10-10
"145",145,145,145,145,145,145,145,101111,"old_trees",1192,1011,1,0.1,1.2,101,1.3,"F","A","A","",1,1,106,"A","","","","","A",1,95,90,"","",0,NA,NA,NA,NA,NA,NA,"1563d197-fb9e-4064-a0da-9850f174df96","3/30/2023 4:12:53 PM","shuej21","7/13/2023 5:52:11 PM","shuej21","litu",101,NA,NA,NA,"","litu","1",747560.90251368,4308711.86187254,"EM","KB,EM","7/13/2023 5:52:01 PM",0,-78.1456269604619,38.892419450602,180.099999920087,201.191146339772,NA,"A",2023-07-13
"146",146,146,146,146,146,146,146,101116,"old_trees",1197,1011,1,9.2,2.1,210,1.3,"F","A","A","",1,1,212,"A","","","","","A",3,100,100,"","",0,NA,NA,NA,NA,NA,NA,"f7b8f310-00da-463e-a05d-8b7d5c09f62c","3/30/2023 4:12:53 PM","shuej21","7/13/2023 5:53:55 PM","shuej21","cagl",210,NA,NA,NA,"","cagl","1",747569.979227556,4308712.97281619,"EM","KB,EM","7/13/2023 5:53:18 PM",0,-78.1455220264889,38.892426891993,189.200043997027,202.085726403498,NA,"A",2023-07-13
"147",147,147,147,147,147,147,147,101118,"old_trees",1199,1011,1,1.1,3,222,1.3,"F","A","A","",1,1,236,"A","","","POM changed to 1.3 on uphill side of tree","","A",3,100,95,"","",0,NA,NA,NA,NA,NA,NA,"c7c8515e-4ede-4a73-a2c6-605c223cb9e5","3/30/2023 4:12:53 PM","shuej21","12/5/2023 4:46:48 PM","shuej21","litu",222,NA,NA,NA,"POM changed to 1.3 on uphill side of tree;","litu","1",747561.836757972,4308713.72990329,"EM","KB,EM","12/5/2023 4:46:08 PM",0,-78.1456155276057,38.8924360002406,181.077329760373,203.036410460249,NA,"A",2023-12-04
"148",148,148,148,148,148,148,148,101119,"old_trees",1200,1011,1,0.4,6.4,106,1.3,"F","A","A","",1,1,110,"A","","","","","A",1,100,98,"","",0,NA,NA,NA,NA,NA,NA,"d10323b0-f665-4d50-933a-e6de2aef9990","3/30/2023 4:12:53 PM","shuej21","12/5/2023 4:47:48 PM","shuej21","cato",106,NA,NA,NA,"","cato","1",747561.081821331,4308717.06750749,"EM","KB,EM","12/5/2023 4:47:08 PM",0,-78.1456230186526,38.8924662524397,180.400026356386,206.391038456053,NA,"A",2023-12-04
"149",149,149,149,149,149,149,149,101121,"old_trees",1202,911,1,20,16.6,127,1.3,"F;L","A","A","",1,1,127,"A","","","","","A",1,100,90,"","",0,22,NA,NA,NA,NA,NA,"9f2779bf-4955-4c10-91d0-a72ff0acb5b2","3/30/2023 4:12:53 PM","shuej21","7/13/2023 6:04:48 PM","shuej21","qupr",127,NA,NA,19,"","qupr","1",747560.445267626,4308727.25542322,"EM","KB,EM","7/13/2023 6:04:01 PM",0,-78.1456266765855,38.8925581262498,179.99999640501,216.591219335738,NA,"A",2023-07-13
"150",150,150,150,150,150,150,150,101123,"old_trees",1204,1012,1,4.8,1.1,488,1.3,"F","A","A","",1,1,395,"AU","DV","DV","POM changed to 1.3 on uphill side of tree, dbh at previous POM 408 so not sure how they got 488 last census","DBH decreased more than expected (-93), check measurement","AU",3,95,95,"K","K",0,NA,NA,NA,1,NA,NA,"646ab60b-11e9-4be1-8720-986b8b42920b","3/30/2023 4:12:53 PM","shuej21","7/13/2023 6:07:37 PM","shuej21","quve",488,NA,NA,NA,"POM changed to 1.3 on uphill side of tree, dbh at previous POM 408 so not sure how they got 488 last census;","quve","1",747565.139592284,4308731.86555985,"EM","KB,EM","7/13/2023 6:07:16 PM",0,-78.1455709514082,38.8925982962686,184.800009538403,221.08831296606,NA,"AU",2023-07-13
"151",151,151,151,151,151,151,151,101125,"old_trees",1206,1012,1,6.3,2.1,143,1.3,"F","A","A","",1,1,140,"A","","","","","A",1,100,95,"","",0,NA,NA,NA,NA,NA,NA,"87e2001c-2276-429b-9765-dc7c676beeb9","3/30/2023 4:12:53 PM","shuej21","7/13/2023 6:09:05 PM","shuej21","cagl",143,NA,NA,NA,"","cagl","1",747566.615982149,4308732.90007496,"EM","KB,EM","7/13/2023 6:09:01 PM",0,-78.1455535753005,38.89260719124,186.300002066796,222.087393154156,NA,"A",2023-07-13
"152",152,152,152,152,152,152,152,101129,"old_trees",1210,1012,1,8.9,6.2,522,1.3,"F","A","A","",1,1,542,"A","","","","","A",3,95,90,"","",0,NA,NA,NA,NA,NA,NA,"dbe4f83a-1d84-424d-80df-c48ce7d637f1","3/30/2023 4:12:53 PM","shuej21","7/13/2023 6:16:27 PM","shuej21","quve",522,NA,NA,NA,"","quve","1",747569.120105677,4308737.0592852,"EM","KB,EM","7/13/2023 6:16:06 PM",0,-78.1455232365055,38.8926439198685,188.89994236719,226.185820505908,NA,"A",2023-07-13
"153",153,153,153,153,153,153,153,101132,"old_trees",1214,1012,1,0.6,9.4,147,1.3,"F","A","A","",1,1,151,"A","","","","","A",1,100,100,"","",0,NA,NA,NA,NA,NA,NA,"b1c46756-c296-40dc-a28c-f67ad03a3227","3/30/2023 4:12:53 PM","shuej21","7/13/2023 6:27:54 PM","shuej21","cato",147,NA,NA,NA,"","cato","1",747560.748194554,4308740.06590317,"EM","KB,EM","7/13/2023 6:27:21 PM",0,-78.1456185692853,38.8926733392596,180.600035866717,229.390859383218,NA,"A",2023-07-13
"154",154,154,154,154,154,154,154,101133,"old_trees",1215,1012,1,1.1,10.2,101,1.3,"F","A","A","",1,1,108,"A","","","POM changed to 1.3 on uphill side of tree","","A",1,100,100,"","",0,NA,NA,NA,NA,NA,NA,"365f0032-e5f8-4a5b-881a-a485ea6b54fa","3/30/2023 4:12:53 PM","shuej21","7/13/2023 6:27:08 PM","shuej21","fagr",101,NA,NA,NA,"POM changed to 1.3 on uphill side of tree;","fagr","1",747561.229488242,4308740.87730782,"EM","KB,EM","7/13/2023 6:27:01 PM",0,-78.1456127338306,38.8926805065493,181.100024032889,230.190578126266,NA,"A",2023-07-13
"155",155,155,155,155,155,155,155,101134,"old_trees",1216,1012,1,0.1,12.3,204,1.3,"F","A","A","",1,1,209,"A","","","","","A",1,100,100,"","",0,NA,NA,NA,NA,NA,NA,"b26e2e57-49fb-4c6a-ba45-2cc8c3e6d352","3/30/2023 4:12:53 PM","shuej21","7/13/2023 6:29:00 PM","shuej21","cato",204,NA,NA,NA,"","cato","1",747560.180976739,4308742.95352376,"EM","KB,EM","7/13/2023 6:28:33 PM",0,-78.1456240606833,38.892699488573,180.099961465426,232.291163072175,NA,"A",2023-07-13
"156",156,156,156,156,156,156,156,101137,"old_trees",1219,1012,1,6.6,10.4,165,1.25,"A;F","A","A","",1,1,165,"AU","","","","","AU",1,90,90,"B","B",0,NA,NA,NA,NA,NA,NA,"44bb494e-1470-41af-91f6-5ee848021566","3/30/2023 4:12:53 PM","shuej21","7/13/2023 6:26:08 PM","shuej21","amar",165,NA,NA,NA,"","amar","1",747566.723377433,4308741.20489811,"EM","KB,EM","7/13/2023 6:26:04 PM",0,-78.1455493442321,38.8926819070035,186.60003446235,230.387307096343,NA,"AU",2023-07-13
"157",157,157,157,157,157,157,157,101143,"old_trees",1226,1012,1,6.2,18.6,226,1.3,"F","A","A","",1,1,240,"A","","","POM changed to 1.3 on uphill side of tree","","A",1,100,100,"","",0,NA,NA,NA,NA,NA,NA,"c40e6b22-8570-4509-b91a-3af10c1e5e71","3/30/2023 4:12:53 PM","shuej21","7/13/2023 6:23:54 PM","shuej21","litu",226,NA,NA,NA,"POM changed to 1.3 on uphill side of tree;","litu","1",747566.133183971,4308749.39341046,"EM","KB,EM","7/13/2023 6:23:15 PM",0,-78.1455531890156,38.8927557724874,186.199967533151,238.587547573071,NA,"A",2023-07-13
"158",158,158,158,158,158,158,158,101147,"old_trees",1230,1013,1,5.4,1.3,118,1.3,"F","A","A","",1,1,120,"A","","","","","A",1,100,100,"","",0,NA,NA,NA,NA,NA,NA,"2eb7f6fc-e694-44f0-9ea5-3a6dd0f958ed","3/30/2023 4:12:53 PM","shuej21","7/13/2023 6:35:55 PM","shuej21","cato",118,NA,NA,NA,"","cato","1",747565.270813494,4308752.07408219,"EM","KB,EM","7/13/2023 6:35:19 PM",0,-78.1455621541978,38.8927801423612,185.400018840304,241.287986417207,NA,"A",2023-07-13
"159",159,159,159,159,159,159,159,101148,"old_trees",1231,1013,1,8.1,1.8,201,1.3,"F","A","A","",1,1,212,"AU","","","","","AU",1,100,100,"K","K",0,NA,NA,NA,2,NA,NA,"15dc84dd-c000-48e3-8459-e8111f6dccec","3/30/2023 4:12:53 PM","shuej21","7/13/2023 6:22:37 PM","shuej21","litu",201,NA,NA,NA,"","litu","1",747567.958510196,4308752.6366001,"EM","KB,EM","7/13/2023 6:22:04 PM",0,-78.1455309979382,38.8927844479015,188.100042193407,241.786370950769,NA,"AU",2023-07-13
"160",160,160,160,160,160,160,160,101150,"old_trees",1234,1013,1,13.6,2.3,134,1.3,"F","A","A","",1,1,136,"A","","","","","A",1,100,100,"","",0,NA,NA,NA,NA,NA,NA,"da829cc8-98cb-46ae-b735-ddfd5f3bb67f","3/30/2023 4:12:53 PM","shuej21","7/13/2023 6:34:00 PM","shuej21","fagr",134,NA,NA,NA,"","fagr","1",747573.445423607,4308753.26399191,"EM","KB,EM","7/13/2023 6:33:25 PM",0,-78.1454675804918,38.892788548581,193.600033902923,242.282982531087,NA,"A",2023-07-13
"161",161,161,161,161,161,161,161,101151,"old_trees",1235,1013,1,19.1,0.2,492,1.3,"F","A","A","",1,1,529,"A","DV","DV","POM changed to 1.3 on uphill side of tree","","A",3,100,90,"","",0,NA,NA,NA,NA,NA,NA,"f76a95f3-404d-448b-8268-63f622e55bb3","3/30/2023 4:12:53 PM","shuej21","7/13/2023 6:33:02 PM","shuej21","litu",492,NA,NA,NA,"POM changed to 1.3 on uphill side of tree;","litu","1",747578.992572934,4308751.29218668,"EM","KB,EM","7/13/2023 6:32:32 PM",0,-78.1454044064902,38.8927692386643,199.099945786643,240.179699717693,NA,"A",2023-07-13
"162",162,162,162,162,162,162,162,101152,"old_trees",1236,1013,1,14,9,561,1.3,"F","A","A","",1,1,571,"AU","","","","","AU",3,90,85,"K","K",0,NA,NA,NA,1,NA,NA,"d628bbe3-8bea-448c-bcb1-43fa6692fc22","3/30/2023 4:12:53 PM","shuej21","7/13/2023 6:48:32 PM","shuej21","qupr",561,NA,NA,NA,"","qupr","1",747573.689787942,4308759.97147779,"EM","KB,EM","7/13/2023 6:48:10 PM",0,-78.1454623478031,38.8928488492045,193.999941392914,248.982751548519,NA,"AU",2023-07-13
"163",163,163,163,163,163,163,163,101155,"old_trees",1239,1013,1,10.1,4.5,185,1.3,"F","A","A","",1,1,190,"A","","","","","A",1,100,95,"","",0,NA,NA,NA,NA,NA,NA,"116e1a38-92e4-4795-abf5-8ab21901aa9a","3/30/2023 4:12:53 PM","shuej21","7/13/2023 6:34:50 PM","shuej21","cato",185,NA,NA,NA,"","cato","1",747569.895272769,4308755.38229511,"EM","KB,EM","7/13/2023 6:34:20 PM",0,-78.1455077028319,38.8928086143033,190.099981686168,244.485188181295,NA,"A",2023-07-13
"164",164,164,164,164,164,164,164,101159,"old_trees",1243,1013,1,3.2,6.7,234,1.3,"F","A","A","",1,1,235,"AU","","","","","AU",1,100,95,"K","K",0,NA,NA,NA,1,NA,NA,"50a91ad4-dc1a-4aa6-8d24-3442282c529a","3/30/2023 4:12:53 PM","shuej21","7/13/2023 6:36:59 PM","shuej21","cagl",234,NA,NA,NA,"","cagl","1",747562.946133519,4308757.42161331,"EM","KB,EM","7/13/2023 6:36:13 PM",0,-78.1455869988929,38.8928289268314,183.200023464946,246.689335759486,NA,"AU",2023-07-13
"165",165,165,165,165,165,165,165,101162,"old_trees",1247,1014,1,2.9,0.9,449,1.3,"NULL","A","DS","Dead on the ground at time of field fixes",1,1,0,"DC","","","","","",NA,NA,NA,"","",NA,NA,NA,NA,NA,NA,NA,"ad4ab89b-eb24-4963-91e8-6e9cda1e3c2d","3/30/2023 4:12:53 PM","shuej21","7/13/2023 6:55:02 PM","shuej21","qupr",449,NA,NA,NA,"","qupr","1",747562.316679916,4308771.61079448,"EM","KB,EM","7/13/2023 6:55:00 PM",0,-78.1455891323829,38.8929568112844,182.899918228518,260.889479440842,0,"",2023-07-13
"166",166,166,166,166,166,166,166,101163,"old_trees",1248,1014,1,10.1,3.1,256,1.3,"NULL","A","DS","",1,1,0,"DS","","","","","",1,0,0,"","",0,NA,NA,NA,NA,0,NA,"a623030f-c86b-47ac-9477-0b22e1846b53","3/30/2023 4:12:53 PM","shuej21","7/13/2023 6:55:57 PM","shuej21","nysy",256,NA,NA,NA,"","nysy","1",747569.463825226,4308773.9772906,"EM","KB,EM","7/13/2023 6:55:27 PM",0,-78.1455059672767,38.8929760966733,190.100040992069,263.085184872924,0,"",2023-07-13
"167",167,167,167,167,167,167,167,101164,"old_trees",1249,1014,1,2.7,7.6,177,1.3,"NULL","A","A","",1,1,188,"A","","","","","A",1,100,95,"","",0,NA,NA,NA,NA,NA,NA,"0c2d250b-56b5-4415-b7dc-cbe4f97161cf","3/30/2023 4:12:53 PM","shuej21","7/13/2023 7:01:53 PM","shuej21","litu",177,NA,NA,NA,"","litu","1",747561.961426988,4308778.30438627,"EM","KB,EM","7/13/2023 7:01:24 PM",0,-78.1455908104315,38.8930171558134,182.700047502809,267.58963071413,NA,"A",2023-07-13
"168",168,168,168,168,168,168,168,101170,"old_trees",1255,1014,1,2.2,16,442,1.3,"M","A","A","",1,1,457,"A","","","POM changed to 1.3 on uphill side of tree","","A",3,100,100,"","",0,NA,NA,NA,NA,NA,NA,"3670e1ab-a084-4735-82d8-4602345d3d0a","3/30/2023 4:12:53 PM","shuej21","7/13/2023 7:08:21 PM","shuej21","litu",442,NA,NA,NA,"POM changed to 1.3 on uphill side of tree;","litu","1",747561.266614955,4308786.69047442,"EM","KB,EM","7/13/2023 7:08:01 PM",1,-78.1455957888885,38.8930928290164,182.199973778494,275.989881205066,NA,"A",2023-07-13
"169",169,169,169,169,169,169,169,101174,"old_trees",1259,1014,1,6.8,19.9,360,1.3,"NULL","A","A","",1,1,355,"A","DV","DV","","DBH decreased more than expected (-5), check measurement","A",3,100,100,"","",0,NA,NA,NA,NA,NA,NA,"0eb317ea-ea66-41c7-8bde-0d5d35f28a08","3/30/2023 4:12:53 PM","shuej21","7/13/2023 7:10:42 PM","shuej21","nysy",360,NA,NA,NA,"","nysy","1",747565.774914422,4308790.6962068,"EM","KB,EM","7/13/2023 7:10:18 PM",0,-78.145542423585,38.8931276115886,186.799990037208,279.887169703841,NA,"A",2023-07-13
"170",170,170,170,170,170,170,170,101176,"old_trees",1261,1015,1,4.6,3.3,488,1.3,"NULL","A","A","",1,1,517,"A","","","POM changed to 1.3 on uphill side of tree","","A",3,100,100,"","",0,NA,NA,NA,NA,NA,NA,"f176d1f8-5bea-4d51-a619-e6fccbe24074","3/30/2023 4:12:53 PM","shuej21","7/13/2023 7:14:04 PM","shuej21","litu",488,NA,NA,NA,"POM changed to 1.3 on uphill side of tree;","litu","1",747563.496616246,4308794.04419449,"EM","KB,EM","7/13/2023 7:14:00 PM",0,-78.1455674551307,38.8931583864766,184.599975986513,283.288438125815,NA,"A",2023-07-13
"171",171,171,171,171,171,171,171,101178,"old_trees",1263,1015,1,7.3,2.2,101,1.3,"NULL","A","A","",1,1,102,"AU","","","","","AU",1,100,98,"K","K",0,NA,NA,NA,1,NA,NA,"ff2b45f3-a65d-420e-8f5b-4281c20a6b5b","3/30/2023 4:12:53 PM","shuej21","7/13/2023 7:12:04 PM","shuej21","nysy",101,NA,NA,NA,"","nysy","1",747566.221427607,4308793.00712845,"EM","KB,EM","7/13/2023 7:12:02 PM",0,-78.1455364479923,38.8931482847963,187.299994793982,282.186808475821,NA,"AU",2023-07-13
"172",172,172,172,172,172,172,172,101181,"old_trees",1267,1015,1,10.8,3.6,261,1.3,"NULL","A","A","",1,1,263,"A","","","","","A",1,100,100,"","",0,NA,NA,NA,NA,NA,NA,"16e62648-8117-41a0-a1a9-c17ed0fcda91","3/30/2023 4:12:53 PM","shuej21","7/14/2023 1:36:47 PM","shuej21","nysy",261,NA,NA,NA,"","nysy","1",747569.687976727,4308794.48800917,"CP","KB,CP","7/14/2023 1:36:13 PM",0,-78.1454959905786,38.8931606364184,190.799966312467,283.584756963211,NA,"A",2023-07-14
"173",173,173,173,173,173,173,173,101183,"old_trees",1269,1015,1,0.6,9.3,384,1.3,"NULL","A","A","",1,1,401,"A","","","","","A",3,100,100,"","",0,NA,NA,NA,NA,NA,NA,"7c427dd4-376b-4739-bd38-553aafdcdbd9","3/30/2023 4:12:53 PM","shuej21","7/13/2023 7:16:52 PM","shuej21","litu",384,NA,NA,NA,"","litu","1",747559.358515086,4308799.94978968,"EM","KB,EM","7/13/2023 7:16:17 PM",0,-78.1456129835284,38.8932127046527,180.599994180736,289.290857451186,NA,"A",2023-07-13
"174",174,174,174,174,174,174,174,101184,"old_trees",1270,1015,1,3.3,8.8,202,1.3,"B","A","AU","",1,1,204,"AU","","","","","AU",1,85,85,"B,W","W",0,NA,2,NA,NA,NA,NA,"a3ed25ad-91ad-4465-a74e-90dba960b744","3/30/2023 4:12:53 PM","shuej21","7/13/2023 7:15:43 PM","shuej21","acru",202,NA,NA,NA,"","acru","1",747562.069379416,4308799.51262343,"EM","KB,EM","7/13/2023 7:15:12 PM",0,-78.1455819206941,38.8932080061999,183.299986961114,288.789289605972,NA,"AU",2023-07-13
"175",175,175,175,175,175,175,175,10119,"old_trees",1276,101,1,15.7,9.3,103,1.3,"M","A","A","",1,1,104,"A","","","Bring nail for tag","","A",2,95,95,"","",0,NA,NA,NA,NA,NA,NA,"237403c7-73ad-4a3d-8885-9ef0d752d979","3/30/2023 4:12:53 PM","shuej21","8/28/2023 3:19:56 PM","shuej21","vipr",103,NA,NA,NA,"Bring nail for tag; ","vipr","1",747400.989086768,4308516.07492088,"IK","RH,IK","8/28/2023 3:19:24 PM",3,-78.1475391695883,38.8907023448915,15.6874934311918,9.26601080086791,NA,"A",2023-08-28
"176",176,176,176,176,176,176,176,101191,"old_trees",1278,1016,1,5.3,2.1,287,1.3,"NULL","A","A","",1,1,291,"A","","","","","A",1,100,98,"","",0,NA,NA,NA,NA,NA,NA,"8dfb3cf1-6c55-480c-92a1-509e7b525f03","3/30/2023 4:12:53 PM","shuej21","7/14/2023 1:47:31 PM","shuej21","nysy",287,NA,NA,NA,"","nysy","1",747563.760332817,4308812.85538037,"CP","KB,CP","7/14/2023 1:47:01 PM",0,-78.1455576356387,38.8933276187511,185.300027772646,302.088017284448,NA,"A",2023-07-14
"177",177,177,177,177,177,177,177,101192,"old_trees",1279,1016,1,6.3,3,624,1.3,"NULL","A","A","",1,1,626,"AU","","","","","AU",3,98,95,"K","K",2,NA,NA,NA,1,NA,NA,"8c5bbb02-0a27-4b18-9eb2-ad13f754f7e3","3/30/2023 4:12:53 PM","shuej21","8/8/2023 7:51:10 PM","shuej21","qual",624,NA,NA,NA,"","qual","1",747564.739201807,4308813.77837207,"CP","KB,CP","8/8/2023 7:50:42 PM",0,-78.1455460294083,38.8933356501526,186.300046064319,302.987447907231,NA,"AU",2023-08-08
"178",178,178,178,178,178,178,178,101196,"old_trees",1282,1016,1,11.6,2.8,207,1.3,"NULL","A","A","",1,1,212,"A","","","","","A",1,100,100,"","",0,NA,NA,NA,NA,NA,NA,"7932daeb-9913-4eab-b941-ea9d6d7666ef","3/30/2023 4:12:53 PM","shuej21","7/14/2023 1:50:14 PM","shuej21","nysy",207,NA,NA,NA,"","nysy","1",747570.042436946,4308813.70140611,"CP","KB,CP","7/14/2023 1:50:04 PM",0,-78.1454849808189,38.8933334631367,191.600068335375,302.784273290289,NA,"A",2023-07-14
"179",179,179,179,179,179,179,179,101203,"old_trees",1290,1012,1,12.1,10,141,1.3,"F","A","A","",1,1,145,"A","","","","","A",1,100,100,"","",0,NA,NA,NA,NA,NA,NA,"69b57498-5c3c-4aaf-adea-1ff707000afe","3/30/2023 4:12:53 PM","shuej21","7/13/2023 6:13:43 PM","shuej21","cato",141,NA,NA,NA,"","cato","1",747572.231211406,4308740.93258761,"EM","KB,EM","7/13/2023 6:13:14 PM",0,-78.1454860103294,38.8926779041981,192.100068647504,229.983973304963,NA,"A",2023-07-13
"180",180,180,180,180,180,180,180,101205,"old_trees",1292,1012,1,18,13.8,103,1.3,"F","A","A","",1,1,106,"A","","","","","A",1,100,95,"","",0,NA,NA,NA,NA,NA,NA,"9d6b0204-2955-4016-b606-3361705c4b69","3/30/2023 4:12:53 PM","shuej21","7/13/2023 6:30:25 PM","shuej21","cato",103,NA,NA,NA,"","cato","1",747578.041376638,4308744.86840523,"EM","KB,EM","7/13/2023 6:30:07 PM",0,-78.1454176773014,38.8927116906424,197.999978314995,233.78037914546,NA,"A",2023-07-13
"181",181,181,181,181,181,181,181,101206,"old_trees",1293,1112,1,0,13.2,382,1.3,"F","A","A","",1,1,373,"A","DV","DV","POM changed to 1.3 on uphill side of tree","DBH decreased more than expected (-9), check measurement","A",3,100,100,"","",0,NA,NA,NA,NA,NA,NA,"d92231c4-3e08-4dd5-bc7f-48147df29126","3/30/2023 4:12:53 PM","shuej21","7/13/2023 6:31:16 PM","shuej21","cagl",382,NA,NA,NA,"POM changed to 1.3 on uphill side of tree;","cagl","1",747580.054826346,4308744.31501979,"EM","KB,EM","7/13/2023 6:31:00 PM",0,-78.1453946885225,38.8927061426539,200.000047972623,233.179225270067,NA,"A",2023-07-13
"182",182,182,182,182,182,182,182,101207,"old_trees",1294,1012,1,17.5,18.2,287,1.3,"F","A","A","",1,1,291,"A","","","","","A",3,100,95,"","",0,NA,NA,NA,NA,NA,NA,"ba797c11-d1b8-423b-8675-37d878067f90","3/30/2023 4:12:53 PM","shuej21","7/13/2023 6:32:10 PM","shuej21","litu",287,NA,NA,NA,"","litu","1",747577.439527861,4308749.25563573,"EM","KB,EM","7/13/2023 6:32:00 PM",0,-78.1454230267648,38.8927513466803,197.500072159492,238.180692176088,NA,"A",2023-07-13
"183",183,183,183,183,183,183,183,101209,"old_trees",1296,1012,1,11.8,15.5,116,1.3,"F","A","A","",1,1,121,"AU","","","","","AU",1,100,100,"K","K",0,NA,NA,NA,1,NA,NA,"3be9da89-fafc-44c4-870c-cc868feebcf8","3/30/2023 4:12:53 PM","shuej21","7/13/2023 6:21:21 PM","shuej21","cato",116,NA,NA,NA,"","cato","1",747571.803602806,4308746.42411342,"EM","KB,EM","7/13/2023 6:21:01 PM",0,-78.1454889550029,38.8927274501437,191.799974643575,235.484121423479,NA,"AU",2023-07-13
"184",184,184,184,184,184,184,184,101210,"old_trees",1298,1012,1,12.4,15,571,1.3,"F","A","A","",1,1,585,"A","","","","","A",3,95,95,"","",0,NA,NA,NA,NA,NA,NA,"52ffe392-118d-47ca-aceb-25aabb9ff98c","3/30/2023 4:12:53 PM","shuej21","7/13/2023 6:20:11 PM","shuej21","quve",571,NA,NA,NA,"","quve","1",747572.415131783,4308745.93823561,"EM","KB,EM","7/13/2023 6:20:02 PM",0,-78.145482087385,38.89272290478,192.400067013261,234.983825329109,NA,"A",2023-07-13
"185",185,185,185,185,185,185,185,101211,"old_trees",1299,1012,1,9.7,10.5,196,1.3,"F","A","A","",1,1,194,"A","DV","DV","","","A",1,98,95,"","",0,NA,NA,NA,NA,NA,NA,"73a6ed0a-15b9-4dc6-b45b-83959a924bc0","3/30/2023 4:12:53 PM","shuej21","7/13/2023 6:15:07 PM","shuej21","cagl",196,NA,NA,NA,"","cagl","1",747569.820175615,4308741.37681187,"EM","KB,EM","7/13/2023 6:15:01 PM",0,-78.1455136173459,38.8926825817104,189.699987450197,230.485460482212,NA,"A",2023-07-13
"186",186,186,186,186,186,186,186,101212,"old_trees",1300,1012,1,10.3,15,740,1.3,"F","A","A","",1,1,758,"AU","","","","","AU",3,90,85,"K","K",0,NA,NA,NA,2,NA,NA,"993786e3-072d-4607-a380-8f2c9536676b","3/30/2023 4:12:53 PM","shuej21","7/13/2023 6:19:13 PM","shuej21","qual",740,NA,NA,NA,"","qual","1",747570.315621502,4308745.88951989,"EM","KB,EM","7/13/2023 6:19:04 PM",0,-78.145506284398,38.8927230579011,190.299991623645,234.985097090268,NA,"AU",2023-07-13
"187",187,187,187,187,187,187,187,101215,"old_trees",1303,1013,1,19,13.4,792,1.3,"NULL","A","AU","",1,1,812,"AU","","CL","POM changed to 1.3 on uphill side of tree","","AU",3,90,90,"F","F",0,NA,NA,NA,NA,NA,NA,"9b5ec584-44ef-4e7b-90f4-ecad284f8ecc","3/30/2023 4:12:53 PM","shuej21","7/13/2023 6:51:18 PM","shuej21","quve",792,NA,NA,NA,"POM changed to 1.3 on uphill side of tree;","quve","1",747578.586437617,4308764.48633046,"EM","KB,EM","7/13/2023 6:51:10 PM",0,-78.1454043265326,38.8928881045346,199.000014569825,253.379772379528,NA,"AU",2023-07-13
"188",188,188,188,188,188,188,188,101217,"old_trees",1305,1013,1,17.6,13,131,1.3,"NULL","A","AU","",1,1,136,"AU","","","","","AU",1,100,95,"W","W",0,NA,2,NA,NA,NA,NA,"37b9e8b0-b884-401a-ab72-eb55cda2d3dc","3/30/2023 4:12:53 PM","shuej21","7/13/2023 6:49:53 PM","shuej21","acru",131,NA,NA,NA,"","acru","1",747577.196113772,4308764.05399594,"EM","KB,EM","7/13/2023 6:49:04 PM",0,-78.1454204944063,38.8928846051517,197.600035061283,252.980653578569,NA,"AU",2023-07-13
"189",189,189,189,189,189,189,189,101219,"old_trees",1307,1013,1,8.8,14.8,136,1.3,"NULL","A","A","",1,1,137,"A","","","","","A",1,98,95,"","",0,NA,NA,NA,NA,NA,NA,"23efce1e-c3b5-4869-8a5c-dc7c3cfad794","3/30/2023 4:12:53 PM","shuej21","7/13/2023 6:46:18 PM","shuej21","cato",136,NA,NA,NA,"","cato","1",747568.356724353,4308765.64928288,"EM","KB,EM","7/13/2023 6:46:01 PM",0,-78.1455217201334,38.8929014539341,188.800034201599,254.78588846525,NA,"A",2023-07-13
"190",190,190,190,190,190,190,190,10122,"old_trees",1308,101,1,15.6,13.6,870,1.3,"NULL","A","AU","",1,1,904,"A","","","Is it alive?","","A",3,100,100,"","",1,NA,NA,NA,NA,NA,NA,"9c14a9ef-f6cf-4b5e-83aa-7265398df96c","3/30/2023 4:12:53 PM","shuej21","7/14/2023 7:35:04 PM","shuej21","juni",870,NA,NA,NA,"Is it alive?; ","juni","1",747400.801335169,4308520.39607339,"EM","EM","7/14/2023 7:35:03 PM",0,-78.1475397750501,38.8907412895676,15.6000400414633,13.5904080034844,NA,"A",2023-07-14
"191",191,191,191,191,191,191,191,101220,"old_trees",1309,1013,1,4,16,125,1.3,"NULL","A","A","",1,1,132,"A","","","","","A",1,100,100,"","",0,NA,NA,NA,NA,NA,NA,"efd78bba-7ae8-42dd-9287-dbdba9cd9b6e","3/30/2023 4:12:53 PM","shuej21","7/13/2023 6:41:50 PM","shuej21","fagr",125,NA,NA,NA,"","fagr","1",747563.530124314,4308766.7377013,"EM","KB,EM","7/13/2023 6:41:15 PM",0,-78.1455769144033,38.8929126100097,183.999983729354,255.988883847177,NA,"A",2023-07-13
"192",192,192,192,192,192,192,192,101221,"old_trees",1310,1013,1,4.1,16.5,122,1.3,"NULL","A","A","",1,1,125,"AU","I","I","Stem indented with hollow areas","","AU",1,100,100,"W","W",0,NA,2,NA,NA,NA,NA,"b26dd0c6-085b-4e88-9382-f41291cf94e4","3/30/2023 4:12:53 PM","shuej21","7/13/2023 6:43:42 PM","shuej21","fagr",122,NA,NA,NA,"Stem indented with hollow areas; ","fagr","1",747563.618536169,4308767.23981957,"EM","KB,EM","7/13/2023 6:43:00 PM",0,-78.1455757151525,38.892917104321,184.100020577705,256.48875543092,NA,"AU",2023-07-13
"193",193,193,193,193,193,193,193,101222,"old_trees",1311,1013,1,5,18.7,222,1.3,"M","A","A","",1,1,240,"A","","","","","A",1,100,100,"","",0,NA,NA,NA,NA,NA,NA,"a443ab31-50ab-442d-92be-9572ac8e6e52","3/30/2023 4:12:53 PM","shuej21","7/13/2023 6:54:26 PM","shuej21","fagr",222,NA,NA,NA,"","fagr","1",747564.467175792,4308769.46009507,"EM","KB,EM","7/13/2023 6:54:00 PM",1,-78.1455651410853,38.8929368483836,184.999940617347,258.688202097409,NA,"A",2023-07-13
"194",194,194,194,194,194,194,194,101223,"old_trees",1312,1013,1,9.4,17.7,679,1.3,"NULL","A","A","",1,1,694,"AU","","","","","AU",3,95,95,"K","K",0,NA,NA,NA,2,NA,NA,"5d37d5f5-b57b-45b4-a36d-a55849266c53","3/30/2023 4:12:53 PM","shuej21","7/13/2023 6:45:07 PM","shuej21","qupr",679,NA,NA,NA,"","qupr","1",747568.889217405,4308768.5624659,"EM","KB,EM","7/13/2023 6:45:00 PM",0,-78.145514537205,38.892927523457,189.399967722112,257.68557142948,NA,"AU",2023-07-13
"195",195,195,195,195,195,195,195,101227,"old_trees",1316,1014,1,16.7,2.8,515,1.3,"NULL","A","A","",1,1,543,"AU","","","","","AU",3,100,100,"K,W","W",0,NA,1,NA,2,NA,NA,"b5e850da-949e-41f5-8659-49bba2e984b0","3/30/2023 4:12:53 PM","shuej21","8/8/2023 7:33:14 PM","shuej21","quru",515,NA,NA,NA,"","quru","1",747576.069003341,4308773.83038575,"CP","KB,EM,CP","8/8/2023 7:33:08 PM",0,-78.1454299500645,38.892972913319,196.70003330143,262.781101630587,NA,"AU",2023-08-08
"196",196,196,196,196,196,196,196,101234,"old_trees",1323,1014,1,13.3,4.2,158,1.3,"NULL","A","A","",1,1,159,"A","","","","","A",1,95,90,"","",0,NA,NA,NA,NA,NA,NA,"f89ad4fa-b241-4e95-8f4e-6aa440adac8a","3/30/2023 4:12:53 PM","shuej21","7/13/2023 6:57:48 PM","shuej21","cagl",158,NA,NA,NA,"","cagl","1",747572.637429215,4308775.15116533,"EM","KB,EM","7/13/2023 6:57:18 PM",0,-78.1454689944271,38.8929857676826,193.300023900254,264.18318718358,NA,"A",2023-07-13
"197",197,197,197,197,197,197,197,101235,"old_trees",1324,1014,1,11.4,1.5,377,1.3,"NULL","A","AU","",1,1,383,"A","","","POM changed to 1.3 on uphill side of tree","","A",3,90,90,"","",0,NA,NA,NA,NA,NA,NA,"0dd4c22e-51c6-4771-bddb-491d945137fb","3/30/2023 4:12:53 PM","shuej21","7/13/2023 6:56:58 PM","shuej21","quve",377,NA,NA,NA,"POM changed to 1.3 on uphill side of tree;","quve","1",747570.800518356,4308772.40782498,"EM","KB,EM","7/13/2023 6:56:20 PM",0,-78.1454911387918,38.8929615943492,191.399963872782,261.484347220741,NA,"A",2023-07-13
"198",198,198,198,198,198,198,198,101238,"old_trees",1327,1014,1,18.4,9.9,105,1.3,"NULL","A","A","",1,1,107,"A","","","","","A",1,100,95,"","",0,NA,NA,NA,NA,NA,NA,"507e5bee-eb04-4884-83dd-4de96720e74b","3/30/2023 4:12:53 PM","shuej21","7/13/2023 7:04:39 PM","shuej21","cagl",105,NA,NA,NA,"","cagl","1",747577.603834169,4308780.9679945,"EM","KB,EM","7/13/2023 7:04:13 PM",0,-78.1454097002436,38.8930367215517,198.400038515113,269.880155274914,NA,"A",2023-07-13
"199",199,199,199,199,199,199,199,101239,"old_trees",1328,1014,1,17.1,14.5,523,1.3,"NULL","A","A","",1,1,535,"A","","","POM changed to 1.3 on uphill side of tree","","A",3,100,100,"","",0,NA,NA,NA,NA,NA,NA,"98e04ab2-91ca-4b26-8af9-9431e9ad7171","3/30/2023 4:12:53 PM","shuej21","7/13/2023 7:05:31 PM","shuej21","cato",523,NA,NA,NA,"POM changed to 1.3 on uphill side of tree;","cato","1",747576.197425976,4308785.53657644,"EM","KB,EM","7/13/2023 7:05:00 PM",0,-78.1454242502491,38.8930782365165,197.099996707804,274.480918928675,NA,"A",2023-07-13
"200",200,200,200,200,200,200,200,101243,"old_trees",1331,1014,1,8.9,10.1,120,1.3,"NULL","A","A","",1,1,123,"A","","","POM changed to 1.3 on uphill side of tree","","A",1,100,100,"","",0,NA,NA,NA,NA,NA,NA,"c67e367f-f8be-4391-85d4-142774d67d18","3/30/2023 4:12:53 PM","shuej21","7/13/2023 7:03:07 PM","shuej21","nysy",120,NA,NA,NA,"POM changed to 1.3 on uphill side of tree;","nysy","1",747568.101730621,4308780.94753049,"EM","KB,EM","7/13/2023 7:03:02 PM",0,-78.1455191410623,38.8930392148177,188.90001761057,270.085871256179,NA,"A",2023-07-13
"201",201,201,201,201,201,201,201,101244,"old_trees",1332,1014,1,9,9.1,822,1.3,"NULL","A","DS","",1,1,822,"DS","","","","","",3,90,0,"","",0,NA,NA,NA,NA,0,NA,"3e04f98b-5bc9-4128-8fcf-08640d2d2ed8","3/30/2023 4:12:53 PM","shuej21","7/13/2023 7:00:57 PM","shuej21","quve",822,NA,NA,NA,"","quve","1",747568.224918731,4308779.95012419,"EM","KB,EM","7/13/2023 7:00:25 PM",0,-78.1455180819495,38.8930302031372,189.000033445466,269.085815352849,822,"",2023-07-13
"202",202,202,202,202,202,202,202,101246,"old_trees",1334,1014,1,2.1,14.3,185,1.3,"NULL","A","A","",1,1,187,"A","","","","","A",1,100,98,"","",0,NA,NA,NA,NA,NA,NA,"523de478-460f-40b6-9cd1-a3476a4f2bbf","3/30/2023 4:12:53 PM","shuej21","7/13/2023 7:07:22 PM","shuej21","litu",185,NA,NA,NA,"","litu","1",747561.206089401,4308784.98863248,"EM","KB,EM","7/13/2023 7:07:01 PM",0,-78.1455970995311,38.8930775289574,182.099982986743,274.289962099196,NA,"A",2023-07-13
"203",203,203,203,203,203,203,203,101250,"old_trees",1338,1015,1,12.4,5,608,1.3,"NULL","A","A","",1,1,610,"AU","","","","","AU",3,100,95,"K","K",0,NA,NA,NA,1,NA,NA,"dc9debd2-c7e5-42a0-9833-aa6a031cebd8","3/30/2023 4:12:53 PM","shuej21","7/14/2023 1:39:25 PM","shuej21","nysy",608,NA,NA,NA,"","nysy","1",747571.255112391,4308795.92472962,"CP","KB,CP","7/14/2023 1:39:00 PM",0,-78.1454774242032,38.8931731257766,192.400011094317,284.983768545358,NA,"AU",2023-07-14
"204",204,204,204,204,204,204,204,101252,"old_trees",1340,1015,1,14,10.8,245,1.3,"NULL","A","A","",1,1,248,"A","","","","","A",1,100,98,"","",0,NA,NA,NA,NA,NA,NA,"1f5f240b-e6ec-4e04-9b04-42777f7bb45c","3/30/2023 4:12:53 PM","shuej21","7/14/2023 1:41:37 PM","shuej21","nysy",245,NA,NA,NA,"","nysy","1",747572.720098567,4308801.76033392,"CP","KB,CP","7/14/2023 1:41:09 PM",0,-78.1454584481938,38.8932252352478,193.999984871623,290.782849112823,NA,"A",2023-07-14
"205",205,205,205,205,205,205,205,101253,"old_trees",1341,1015,1,12.3,11,567,1.3,"NULL","A","A","",1,1,573,"A","","","","","A",3,95,95,"","",0,NA,NA,NA,NA,NA,NA,"86ed26b7-792f-4e3a-8841-e8849a26130f","3/30/2023 4:12:53 PM","shuej21","7/14/2023 1:40:42 PM","shuej21","nysy",567,NA,NA,NA,"","nysy","1",747571.01591371,4308801.92076515,"CP","KB,CP","7/14/2023 1:40:01 PM",0,-78.1454780170877,38.8932271593759,192.299980569729,290.98379881417,NA,"A",2023-07-14
"206",206,206,206,206,206,206,206,101259,"old_trees",1347,1015,1,12.4,17.5,NA,NA,"B;DS","D","DS","",1,1,0,"DC","","","","","",NA,NA,NA,"","",NA,NA,NA,NA,NA,0,NA,"a6b38150-e583-4c4b-b353-abde66a8e9d3","3/30/2023 4:12:53 PM","shuej21","7/14/2023 1:44:51 PM","shuej21","fram",NA,NA,NA,NA,"","fram","1",747570.965121723,4308808.42142112,"CP","KB,CP","7/14/2023 1:44:36 PM",0,-78.1454762581833,38.8932856816286,192.400012867853,297.483821987806,0,"",2023-07-14
"207",207,207,207,207,207,207,207,101264,"old_trees",1352,1015,1,2.6,13.1,759,1.3,"NULL","A","AU","",1,1,775,"DS","R","R","","","",3,85,0,"","",0,NA,NA,NA,NA,0,NA,"68581e9a-ced1-45cf-9a3f-38ff110dfe85","3/30/2023 4:12:53 PM","shuej21","7/14/2023 1:43:38 PM","shuej21","qual",759,NA,NA,NA,"","qual","1",747561.26980925,4308803.79520921,"CP","KB,CP","7/14/2023 1:43:13 PM",0,-78.1455895851153,38.8932467761074,182.599984949184,293.089693836209,775,"",2023-07-14
"208",208,208,208,208,208,208,208,101280,"old_trees",1369,1016,1,16.8,3.8,115,1.3,"NULL","A","A","",1,1,144,"A","RT","RT","","","A",1,100,100,"","",0,NA,NA,NA,NA,NA,NA,"40cb14c7-19bc-4e43-b2ba-d094f61f93a8","3/30/2023 4:12:53 PM","shuej21","7/14/2023 1:51:05 PM","shuej21","caco",115,NA,NA,NA,"","caco","1",747575.217785621,4308814.82173283,"CP","KB,CP","7/14/2023 1:51:01 PM",0,-78.145424973376,38.8933420881336,196.800014905383,303.781096166567,NA,"A",2023-07-14
"209",209,209,209,209,209,209,209,101281,"old_trees",1370,1016,1,19.2,5.3,243,1.3,"NULL","A","A","",1,1,268,"A","","","","","A",3,100,100,"","",0,NA,NA,NA,NA,NA,NA,"cd6ff8dd-e197-4093-9845-a10b6f530784","3/30/2023 4:12:53 PM","shuej21","7/14/2023 1:51:56 PM","shuej21","caco",243,NA,NA,NA,"","caco","1",747577.582267215,4308816.37702283,"CP","KB,CP","7/14/2023 1:51:24 PM",0,-78.1453971813055,38.8933554199629,199.19994174982,305.279664848644,NA,"A",2023-07-14
"210",210,210,210,210,210,210,210,101291,"old_trees",1381,1016,1,12.6,8.7,127,1.3,"NULL","A","A","",1,1,134,"A","","","","","A",1,100,98,"","",0,NA,NA,NA,NA,NA,NA,"10756e56-d976-494e-8653-a9e0af09cbfc","3/30/2023 4:12:53 PM","shuej21","7/14/2023 1:55:11 PM","shuej21","nysy",127,NA,NA,NA,"","nysy","1",747570.905216395,4308819.62301627,"CP","KB,CP","7/14/2023 1:55:01 PM",0,-78.1454729092585,38.8933865163735,192.599992739199,308.683669399854,NA,"A",2023-07-14
"211",211,211,211,211,211,211,211,101292,"old_trees",1382,1016,1,15,9.3,572,1.3,"NULL","A","AU","",1,2,571,"DS","","","Missing tag","","",NA,NA,NA,"","",NA,NA,NA,NA,NA,NA,NA,"a1ce59bc-ef57-4522-baeb-30e92cf20945","3/30/2023 4:12:53 PM","shuej21","5/31/2023 2:31:56 PM","shuej21","fram",572,NA,NA,NA,"Missing tag; ","fram","1",747573.290690746,4308820.27853614,"KB","KB","5/31/2023 2:31:28 PM",0,-78.1454451998335,38.8933917440858,195.000032660356,309.282223194934,571,"",2023-05-31
